issue_id,summary,possibility_toxic
13258430,"""The conversation begins with knocte presenting a problem and expressing frustration with strong language. leehambley responds calmly, acknowledging the issue while also addressing the profanity used by knocte. The tone shifts from confrontational to collaborative as leehambley expresses willingness to consider a patch. However, the conversation takes a turn when knocte questions leehambley's decision to close the issue, introducing a note of confusion and potentially reigniting tension.""",0.42
30381958,"""The conversation starts with a polite and informative tone as ghost presents their suggestion for implementing xBR shader or xBRZ filter. However, the discussion takes a turn when Squall-Leonhart responds with a somewhat dismissive comment, suggesting that ghost should submit a patch instead of asking. The tone remains civil but slightly defensive as ghost explains their limitations as a non-programmer. As more users join the conversation, opinions become more divided, and the tone shifts to one of disagreement and debate. LasagnaPie expresses strong opposition to xBR/xBRZ, calling it ""ugly"" and stating that it ruins the artwork of games. Ghost responds with a mix of frustration and politeness, explaining their perspective on the benefits of xBR/xBRZ. The conversation continues with users presenting counterarguments and personal opinions, but the tone remains relatively respectful despite the disagreements.""",0.13
57258770,"""The conversation starts with a user, spkane, describing an issue with slow download speeds using Vagrant. sethvargo responds by asking for more information and suggesting possible causes. The conversation escalates as multiple users share their own experiences with slow downloads, with some reporting speeds as low as 10kbps. The tone of the conversation remains frustrated, with users expressing disappointment and incredulity that the issue has not been resolved despite years of complaints. Some users suggest workarounds, such as using wget or torrenting boxes, while others call for Hashicorp to address the issue. The conversation also touches on potential causes, including server overload and throttling, but no clear solution is presented.""",0.47
81567058,"""The conversation starts with a polite request for namespacing and evolves into a discussion about using Composer to manage dependencies. The tone remains civil throughout, with speakers providing helpful suggestions and explanations. However, when gabordemooij expresses their preference for not using dependency managers, the conversation takes a slightly defensive turn, with tleb countering with an explanation of the Unix philosophy and the benefits of using tools like Composer. Despite this brief moment of tension, the conversation remains constructive and informative, with speakers sharing their expertise and experiences.""",0.12
93644527,"""The conversation starts with TristisOris suggesting a feature to filter out unwanted file extensions from downloads, which receives positive feedback from thalieht. However, Symbai expresses skepticism about the feature being implemented due to its age. The discussion then shifts to security concerns, with shula highlighting the potential dangers of downloading malicious files and proposing a block list for certain extensions. Multiple users express support for this idea, sharing their own experiences with unwanted files in torrents. Some users also suggest alternative solutions, such as using external scripts or plugins, but others argue that these are not user-friendly enough. The conversation becomes more heated when FranciscoPombal downplays the importance of the feature, suggesting that it's a Windows problem and that users should be more careful. However, simo1994 and PatrickVeenstra counterargue that this is a security issue that qBittorrent should address, especially for non-technical users who may not know how to protect themselves. The tone remains mostly civil, but with some frustration and urgency from users who feel strongly about the need for this feature.""",0.42
119143420,"""The conversation starts with Sega100500 describing an issue they are experiencing, and anujaware responds by asking for clarification. The conversation remains polite and collaborative throughout, with both speakers seeking to understand each other's perspectives. However, as the discussion progresses, Sega100500 becomes increasingly frustrated, using phrases like ""WHY?"" and ""BUG!!!"" to emphasize their point. Meanwhile, anujaware and later adityashedge attempt to reproduce the issue but are unable to do so, leading to a series of back-and-forth exchanges where each side tries to understand the other's perspective. sivagollapalli eventually suggests a possible solution, which Sega100500 acknowledges as not elegant but potentially effective. Throughout the conversation, the tone remains generally civil, although with moments of heightened emotion and frustration.""",0.42
120669472,"""The conversation starts with a user reporting an issue with Doctrine's QueryBuilder and seeking help. The discussion remains civil, with users providing information and asking clarifying questions. However, as the conversation progresses, the tone shifts slightly, with some users expressing frustration and disappointment that the issue has not been resolved after three years. A new user joins the conversation, seeking a workaround, but is met with a defensive response from another user who accuses them of not contributing to the solution. The conversation ends with a tense exchange, with one user being told to be more constructive and provide concrete solutions rather than just complaining.""",0.67
120671163,"""The conversation starts with doctrinebot posting an issue about nullable embeddables, which sparks a discussion among multiple users. The tone is mostly civil and informative, with some users sharing their workarounds and others discussing potential solutions. Ocramius provides guidance on how to implement nullable embeddables manually, while BenMorel shares his thoughts on the ideal behavior of Doctrine in such cases. The conversation also touches on the development of Doctrine 3.x and ways for users to contribute to its development. Throughout the discussion, users express their appreciation for each other's input and acknowledge the complexity of the issue at hand.""",0.00
124545273,"""The conversation starts with emiglobetrotting seeking help with a Composer installation error. The tone remains polite as staabm offers a suggestion to load extensions in php.ini. However, alcohol's response shifts the tone to slightly dismissive and authoritative, implying that the issue is not related to Composer but rather PHP compilation and configuration. The conversation ends abruptly with alcohol closing the issue, leaving emiglobetrotting without further assistance.""",0.73
230340780,"""The conversation starts with AndreSteenveld sharing a solution for installing NVM globally and seeking feedback. ljharb responds by stating that NVM is not intended to be global or system-wide, but rather per-user, per-shell-session. This sparks a debate about the best approach, with some users agreeing with ljharb's assessment and others sharing their own experiences with multiuser usage. The tone remains civil, with users engaging in a constructive discussion about the limitations of NVM and potential alternatives. As the conversation progresses, the focus shifts from AndreSteenveld's initial solution to a broader discussion about the challenges of managing Node versions in a multiuser environment.""",0.04
239227953,"""The conversation starts with a user, jhkrischel, reporting an issue with ansible-vault and providing detailed information about the problem. The discussion is then joined by other users who share their thoughts and ideas on how to address the issue. alikins provides some insights into the potential solutions and limitations of the current implementation. The conversation remains civil and focused on finding a solution, with users sharing their experiences and workarounds. However, as the discussion progresses, it becomes clear that the issue is still unresolved and has been ongoing since Ansible 2.3. Users continue to express their frustration and disappointment with the lack of progress on this feature. The conversation ends with no clear resolution, but with a sense of urgency and importance around addressing this usability problem.""",0.23
245325788,"""The conversation starts with jeffwidman proposing a consistent naming convention for Jinja, and davidism expressing a desire to drop the '2' from the name. The tone remains civil as other users join the discussion, sharing their opinions and concerns. mitsuhiko initially agrees with the proposal but later expresses reservations about the potential backwards incompatibility and the lack of support for parallel installations of incompatible Python libraries. The conversation becomes more nuanced as users discuss the implications of the proposed change, including the potential impact on pickle and other dependencies. Despite some initial enthusiasm, the discussion ultimately reveals significant concerns and uncertainties about the proposal, leading to a more cautious approach.""",0.05
257408022,"""The conversation begins with a polite yet assertive tone from yroc92, who claims a pending trademark application is being violated. lol768 responds with a mix of sarcasm and dismissal, downplaying the severity of the situation. The tone shifts as yroc92 provides additional context and clarification, but also becomes slightly defensive. ddevault then enters the conversation, accusing yroc92 of being disingenuous and questioning their involvement with Caddy. yroc92 responds by establishing their credibility and connection to the project, which somewhat diffuses the tension. Throughout the conversation, the tone remains relatively civil, despite some moments of defensiveness and accusation.""",0.17
268049628,"""The conclusion is that Pipenv's behavior of updating all dependencies when installing a new package is unexpected and counter-intuitive, and there are alternative solutions like Poetry that can manage dependencies more effectively. The discussion highlights the need for a clear standard around `pyproject.toml` and its usage in library definition metadata, as well as the importance of supporting editable installs in pipenv.""",0.00
285132250,"""The conversation begins with orbea expressing frustration about a change in RetroArch's build behavior. Alcaro responds with a sarcastic tone, dismissing orbea's concerns and suggesting that they should instead fix their own buildbots. Orbea refuses to back down, insisting that the issue lies with the script itself, not with the distro packages. The conversation remains tense, with both speakers maintaining their positions and neither willing to concede. Alcaro's tone becomes increasingly condescending, while orbea's responses become more forceful in defense of their stance.""",0.85
298311894,"""The conversation starts with a polite and technical discussion about code changes. The tone remains civil as multiple users provide feedback and engage in a constructive debate. However, the atmosphere shifts when sempervictus makes a comment that could be perceived as slightly sarcastic or teasing, which is met with a lighthearted response from prometheanfire. Later, lxguest's comment introduces a negative tone, accusing behlendorf of being toxic and abusive in the community. This accusation leads to a defensive response from behlendorf, who clarifies that there was no harm done and attributes the issue to a misunderstanding. The conversation ends with a sense of resolution and a return to a more positive tone.""",0.30
304422453,"""The conversation starts with ericmorand reporting an issue with Jekyll syntax highlighting and ashmaroli responding with a suggestion to use triple-backticks instead. However, ericmorand clarifies that the issue persists regardless of the syntax used. The tone remains polite until pathawks intervenes, stating that the issue lies with Rouge rather than Jekyll, and closes the conversation. Ericmorand expresses frustration and confusion, feeling that the maintainers should take care of the issue. Pathawks provides a link to the Rouge repository, suggesting that ericmorand open an issue there, but ericmorand feels that this is not his responsibility. The tone becomes slightly confrontational, with pathawks explaining that the fix must come from Rouge and providing a link to the relevant lexer file.""",0.68
305030419,"""The conversation starts with ghost describing an issue with GitKraken, followed by siprbaum suggesting a potential solution and recommending reporting the bug to GitKraken. pmiossec questions whether the issue is related to git-tfs, expressing skepticism about the relevance of the post. thenexxuz-zz chimes in, agreeing that GitKraken does not use this project. The conversation takes a turn when dennisclausen and aboone2000 share similar experiences with the issue, leading to pmiossec responding defensively, implying that aboone2000's tone is unhelpful and suggesting they should report the issue more politely in the GitKraken slack channel. The overall tone shifts from helpful suggestions to frustration and defensiveness.""",0.68
312953330,"""The conversation starts with jockm expressing frustration about the orange color used for error messages in the Arduino IDE, citing accessibility concerns. Other users, including tofrnr and aldoaldoaldo, share similar sentiments and suggest alternative colors such as white, yellow, or light green. per1234 argues that changing the error text color could worsen the user experience for others, but eventually acknowledges the need for a more accessible solution. The discussion evolves into suggestions for implementing a high contrast mode or a customizable theme option. However, the conversation is ultimately redirected to the Arduino IDE 2.x project, with per1234 suggesting that users create a new issue in the 2.x repository. jockm expresses frustration about the delay and lack of consideration for accessibility concerns, feeling that it has been neglected for too long.""",0.72
313696087,"""The conversation starts with winnilein describing a problem they're experiencing and seeking help. Ocramius responds with a polite and helpful suggestion, asking for more information to troubleshoot the issue. Winnilein provides additional details and test results, which leads to a moment of frustration and irritation when they discover that changing the operator from AND to OR resolves the issue. The tone remains generally civil, but winnilein's emotions escalate as they express their confusion and annoyance at the unexpected solution.""",0.20
315863357,"""The conversation starts with micgro42 introducing the topic of GDPR compliance and asking questions about how DokuWiki handles user data. The discussion is civil and informative, with users sharing their expertise and experiences. However, as the conversation progresses, some users start to get frustrated with the lack of clear answers and the complexity of the issue. Splitbrain becomes defensive and asks others to refrain from posting links to pages that ""explain everything."" Despite this, users continue to share relevant information and engage in a constructive discussion. The tone remains mostly polite, but there are moments of sarcasm and frustration. Ultimately, splitbrain closes the ticket, acknowledging that they may not get definitive answers to all their questions, but encouraging others to contribute to the privacy policy.""",0.24
332965663,"""The conversation starts with kgignatyev-inspur reporting an issue and providing a reproducible case, to which slandelle responds with a brief and somewhat dismissive comment. kgignatyev-inspur takes offense at the tone and asks for a more detailed explanation, providing evidence of their own attempts to troubleshoot the issue. The exchange becomes slightly heated, with kgignatyev-inspur expressing frustration at the lack of clarity in slandelle's initial response.""",0.54
339498894,"""The conversation starts with c3ph3us expressing frustration and confusion about a Gradle build failure, using strong language to describe their experience. They attempt multiple times to resolve the issue, but each try ends in failure. As the conversation progresses, c3ph3us's tone becomes increasingly exasperated and sarcastic. oehme eventually intervenes, closing the conversation due to abusive language and reminding c3ph3us of the community's code of conduct.""",0.83
352750519,"""The conversation begins with dhh proposing a change in terminology for Rails, which is met with skepticism by shalvah, who expresses doubt about the necessity of the change and finds it patronizing. The tone remains polite but slightly defensive. ghost intervenes with a neutral comment providing additional context, but dhh refocuses the conversation on the clarity of the proposed terms, rather than their origins. Throughout the exchange, the speakers maintain a civil tone, with no personal attacks or aggressive language.""",0.04
356609376,"""The conversation begins with RNCTX seeking help with downgrading their ZFS pool from Linux to FreeBSD. However, loli10K responds by scolding RNCTX for not following rules and requests, shifting the focus away from the technical issue at hand. The tone becomes slightly confrontational as loli10K's response comes across as dismissive and unhelpful. RNCTX does not respond with aggression or defensiveness, but rather seeks clarification on their original question, which remains unanswered.""",0.42
406907882,"""The conversation starts with a technical discussion between tomjn and rtri about a code snippet. However, the tone shifts when tomjn expresses frustration and accuses rtri of being overly hasty in closing a pull request. Rtri responds calmly, explaining their reasoning, but tomjn's tone remains confrontational. The conversation becomes more heated, with tomjn implying that rtri is discouraging contributions. Rtri attempts to clarify their intentions, but the exchange remains tense.""",0.83
421471669,"""The discussion revolves around the behavior of lubridate's `hours()` and `dhours()` functions when dealing with daylight saving time (DST) transitions. The expected output for adding hours to a datetime object during DST transition is debated, with some expecting it to follow the clock time and others expecting it to follow the wall-clock time. The conversation highlights the complexity of date-time arithmetic and the importance of understanding the underlying implementation details.""",0.10
430055555,"""The conversation starts with Patrickdroid describing an issue with Retroarch's handling of vertically oriented games. Ghost responds by explaining that some arcades have rotated monitors, which can affect the emulator's output. However, Patrickdroid clarifies that the emulator-provided resolution should not be changed, regardless of orientation. The discussion becomes more technical, with both speakers presenting their perspectives and using examples to support their arguments. Ghost shares a video link to illustrate their point, but Patrickdroid reiterates their concern about scaling artifacts and incorrect internal resolutions. Throughout the conversation, both speakers remain polite and focused on the issue at hand, with no personal attacks or aggressive tone.""",0.01
432631890,"""The conversation starts with Zirias reporting a build issue and providing a patch. arr2036 responds with a suggestion to specify libressl version numbers in patches, which leads to a disagreement between the two speakers about how to handle libressl compatibility. The tone becomes slightly confrontational as arr2036 implies that supporting libressl is not a priority and criticizes the quality of patches submitted for it. Zirias defends their approach and argues that using libressl version numbers is not practical due to its API changes. The conversation ends with arr2036 reiterating their concerns about maintaining compatibility with libressl without proper documentation.""",0.42
435537996,"""The conversation starts with a user suggesting an option to ignore CRC while scanning ROMs for playlists, citing difficulties with unique CRC32 values. The discussion becomes defensive as another user explains the reasoning behind validating checksums and the potential issues with ignoring them. The tone remains civil but slightly tense throughout, with users presenting counterarguments and alternative solutions. A third user joins in, suggesting a different approach to playlist management, which sparks further debate. As the conversation progresses, a fourth user expresses frustration with the current state of the project's database and scanner, leading to a more heated exchange. The tone shifts towards negativity and criticism, prompting another user to intervene and ask for constructive contributions rather than complaints.""",0.68
436303024,"""The conversation begins with a suggestion to rephrase a command due to its perceived aggressiveness. Speaker2 disagrees, arguing that the term is not aggressive and has been commonly used in the past. Speaker3 joins in, supporting the initial suggestion and advocating for a less aggressive approach. Speaker2 defends their stance, emphasizing the importance of familiarity and efficiency. The tone remains polite and focused on the issue at hand, with speakers engaging in a respectful debate.""",0.00
483355054,"""The conversation starts with Tectract expressing frustration and disappointment towards a recent change that broke their app. yuki24 responds calmly, providing context and clarifying that the issue is a feature request rather than a bug report. Tectract persists in their argument, accusing the developers of breaking existing functionality and advocating for a warning instead of an error. yuki24 remains polite but firm, explaining the reasoning behind the change and the need for consistency across different databases. The tone remains civil throughout, with both parties engaging in a constructive discussion despite their differing opinions.""",0.05
484737447,"""The conversation starts with HTMLGuyLLC seeking help and information about a technical issue, expressing frustration but also politeness by acknowledging they don't want to be 'hand-held' through debugging. Tobion responds with a mix of inquiry and deflection, asking for more details while also implying that the question is not suitable for the current forum and redirecting HTMLGuyLLC to another resource. The tone shifts from polite to slightly dismissive, with Tobion's response coming across as somewhat abrupt.""",0.42
494492439,"""The conversation starts with votdev describing an issue with mounting a filesystem to a mount point containing blanks. The-Arioch responds, sharing their experience with building a home NAS and criticizing Salt's handling of partitions. They discuss the use of hex-escaped strings for disk names and the potential issues that can arise from it. Votdev clarifies that escaping blanks is not their idea but rather a convention used by userland commands. The conversation continues with The-Arioch sharing their research on the topic, including the use of systemd escaped paths in `/etc/fstab`. They also discuss potential race conditions in OMV when different partitions have the same label. Votdev suggests that OMV's workaround for the issue is not effective and proposes a patch to make space-containing mount points visible. The-Arioch tests the patch and finds it working, but then discovers that changing the partition label and mounting the disk from OMV Web UI results in no space-containing mountpoint path. They conclude that the workaround may be unnecessary.""",0.04
510675125,"""The conversation starts with marekdedic proposing a new feature for Composer, which is met with skepticism by stof and Seldaek. The discussion revolves around the use cases for the proposed feature, with marekdedic explaining his needs for building and deploying applications. Seldaek suggests alternative solutions that don't require adding a new parameter, but marekdedic explains why these solutions won't work for him. alcohol chimes in, questioning the relevance of the proposal, but marekdedic clarifies his use case. The conversation remains civil, with participants engaging in a back-and-forth discussion to understand each other's perspectives.""",0.00
518811026,"""The conversation starts with kpetrow describing an issue with flickering edges in a Three.js application and seeking help. Mugen87 responds by asking for more information and a live example to debug the issue. As the conversation progresses, kpetrow provides additional details and examples, including a video demonstrating the problem. Other users, such as arpu and sciecode, join the conversation and offer their insights, with sciecode suggesting that the issue may be related to NVIDIA drivers. The conversation becomes more technical, with discussions of shader changes, light probes, and NaN values in geometry data. kpetrow eventually identifies the root cause of the issue and proposes a fix, which is met with some resistance from WestLangley and Mugen87, who argue that handling NaN values is an application-level problem rather than a library bug. The conversation concludes with kpetrow expressing frustration at the pushback and seeking suggestions for dealing with real-world data that contains NaN values.""",0.42
