issue_id,summary,possibility_toxic
1198733592,"""The conversation starts with nxg presenting an issue with Python-Markdown's handling of certain URLs, suggesting that it should render them as links instead of passing them through verbatim. waylan responds, explaining that Python-Markdown is not a CommonMark implementation and that the reference implementation only recognizes HTTP URLs. He also states that the responsibility for invalid input lies with the document author, not the Markdown processor. nxg counters that the 'spirit of Markdown' is to assume the user is never wrong and suggests that python-markdown should have sensible defaults. waylan reiterates that everything in angle brackets is considered raw HTML unless it's an auto link and suggests that expanding auto links might be worth considering, but any changes would need to be carefully tested.""",0.13
1198986956,"""The conversation starts with angryziber describing an issue and providing logs and system information. Conduitry suggests a workaround, which mrkishi builds upon by proposing an alternative solution involving running `sync` from `@sveltejs/kit`'s `postinstall`. dominikg expresses concerns about the reliability of lifecycle scripts and proposes removing the `prepare` script as a temporary fix. The conversation remains civil throughout, with speakers engaging in constructive discussion and refuting each other's points. Eventually, benmccann explains how Vite handles config files, and dominikg announces that the latest version of `@sveltejs/kit` uses a `postinstall` hook to run `sync`, which resolves the issue.""",0.00
1205453556,"""The conversation starts with songzhj sharing an issue they encountered while rebuilding a module using electron-rebuild. retsimx shows support for the post, and kryops shares their similar experience and suggests a possible workaround by updating native dependencies to versions that have prebuilt binaries for Electron 18. Ciberusps also reports having the same trouble but finds it resolved after some unknown change. The conversation then shifts to speculation about what might have caused the issue, with kryops suggesting a possible fix from an Electron pull request and Joey-Coder reporting success using VS2019 instead of VS2017. Throughout the conversation, users show agreement and support for each other's experiences, but no clear resolution or explanation is reached.""",0.05
1208168791,"""The conversation begins with lisbonjoker suggesting an idea for localization to make based.cooking more accessible worldwide. ermitxyz expresses enthusiasm and shares a personal anecdote, highlighting the need for this feature. LukeSmithxyz responds with a mix of openness and hesitation, indicating willingness to consider contributions but also setting boundaries due to limitations in managing multiple languages himself. lisbonjoker then offers to take on the task, specifically handling the Portuguese language, which brings a sense of resolution and direction to the conversation.""",0.00
1210146025,"""The conversation starts with a polite and informative tone, as kglazier provides detailed information about their code changes. The discussion remains civil throughout, with speakers expressing gratitude for each other's input. Joel-wenzel asks clarifying questions, and kglazier responds helpfully. The conversation is collaborative, with speakers working together to ensure the changes are accurate and complete. There is no apparent tension or conflict, and the tone remains professional and respectful.""",0.00
1212326115,"""The conversation begins with a detailed problem description by spand, who documents an issue with the Joda-Time library. The tone remains civil and informative throughout the conversation. jodastephen responds with a solution and acknowledges potential risks, but believes they are small. jahar-tyagi asks for clarification on the impact of the change on application code, and jodastephen provides reassurance that most applications will not be affected. The conversation continues with jahar-tyagi asking follow-up questions, which jodastephen answers clearly and concisely. Overall, the tone remains polite and helpful, with a focus on resolving the issue at hand.""",0.00
1212344352,"""The conversation starts with M-warrior asking a question, which is met with a dismissive response from Jhonatanbb. SethFalco intervenes, providing a link to relevant information and setting a polite tone. However, jamieu187's subsequent messages express confusion and frustration, leading to a shift in the conversation's tone. Despite this, the overall discussion remains relatively civil, with participants attempting to provide helpful responses.""",0.21
1213454450,"""The conversation starts with Shujee reporting an issue and providing detailed information to reproduce it. Rhilip and iamKyun chime in, agreeing with Shujee's observation and adding their own findings. The tone remains polite and collaborative throughout. Johnleider then joins the conversation, offering a solution and providing examples of how to fix the issue. The overall tone shifts from reporting an issue to finding a resolution, with all speakers working together to provide a helpful outcome.""",0.00
1213607968,"""The conversation begins with nopeless seeking help for an error and KaelWD providing a response. The tone remains polite, with nopeless expressing gratitude and KaelWD offering clarification. As the conversation progresses, nopeless shares a reproduction of the issue, which leads to KaelWD investigating further. KaelWD eventually identifies the cause of the problem and resolves it by removing unused code. Throughout the conversation, both speakers maintain a collaborative tone, with nopeless seeking confirmation and KaelWD providing explanations.""",0.00
1213629139,"""The conversation starts with keyhan-va proposing a new feature and providing context and testing details. The tone remains civil throughout the conversation. johnleider questions whether the feature is being considered for v2.x, and keyhan-va confirms that it's needed for production v2.x. nekosaur responds with a suggestion to add the class manually, but keyhan-va explains that it's not clear which tables are selectable without the class, and adding it would improve the user experience.""",0.00
1218080423,"""The conversation begins with igordsm presenting an issue with web components and proposing a solution. waylan responds by questioning the specification of custom HTML component names, which leads to igordsm providing relevant links. The tone remains polite and informative throughout. waylan then explains how Python-Markdown handles raw HTML and suggests a logical approach to supporting custom elements, which involves requiring users to ""register"" the elements. igordsm thanks waylan for the detailed feedback and agrees to make changes accordingly.""",0.00
1218544859,"""The conversation starts with hlecorche posting a technical error message, which greg0ire responds to by providing context and suggesting a possible solution. The tone remains neutral and collaborative throughout the conversation. Greg0ire also mentions a related pull request and shares his thoughts on how to avoid similar errors in the future. Derrabus joins the conversation, pointing out an issue with the ORM emitting an `E_USER_NOTICE` error, but later clarifies that it's already fixed by a specific commit. The overall tone of the conversation is informative, helpful, and focused on resolving technical issues.""",0.00
1218592940,"""The conversation starts with a positive tone as greg0ire acknowledges hlecorche's contribution and provides constructive feedback on improving commit messages. However, the discussion takes a slightly critical turn when greg0ire expresses confusion about Psalm failures, prompting hlecorche to clarify and stof to offer an explanation. The conversation remains civil and collaborative, with speakers building upon each other's ideas and offering suggestions for improvement. As the discussion progresses, hlecorche proposes potential solutions, which are met with thoughtful feedback from stof. Just as it seems like a consensus is being reached, derrabus intervenes to close the issue in favor of an alternative solution (#366), ending the conversation on a slightly abrupt note.""",0.14
1222266778,"""The conversation starts with stefann42 reporting an issue with Ghost's SSL configuration. daniellockyer responds by asking for clarification and providing additional information, which leads to a back-and-forth discussion between them. The tone remains polite and collaborative throughout. stefann42 eventually finds a solution and shares it with the group. ErisDS joins the conversation, provides additional context, and explains that mysql2 is picky about configuration. A new user, berayb, enters the conversation with a similar issue, but ErisDS redirects them to a different thread. The conversation remains helpful and informative, with users working together to resolve their issues.""",0.00
1222761258,"""The conversation begins with a polite and friendly tone, with ceecko submitting an issue report and ErisDS responding with gratitude and a review of the PR. The discussion remains civil and focused on the technical topic at hand, with matthanley providing additional information about the release timeline. Throughout the conversation, all participants maintain a professional and courteous demeanor, with no signs of tension or conflict.""",0.00
1224225495,"""The conversation begins with ronaldlangeveld introducing their contribution, an image exporter feature, and ErisDS responding with appreciation but also caution. ErisDS raises concerns about the feasibility of the feature due to potential performance issues and security risks, providing detailed explanations and references to previous discussions. The tone remains polite and constructive throughout, with ErisDS aiming to provide guidance rather than dismissal. ronaldlangeveld acknowledges ErisDS's feedback, expressing gratitude for the insight and acknowledging that their gut feeling about potential issues was correct. The conversation concludes with ErisDS closing the discussion but leaving the door open for future non-blocking implementations.""",0.05
1224350588,"""The conversation begins with matthanley providing context and explanation for a migration, followed by github-actions[bot] reviewing the migration and checking off requirements. codecov[bot] then provides a report on the code coverage, which is met with no immediate response or discussion. The tone remains neutral and informative throughout. SimonBackx later expresses uncertainty about releasing the change without making an additional modification, to which matthanley responds by linking to another pull request that addresses the concern.""",0.01
1225627893,"""The conversation starts with chuckcarne sharing an error message and seeking help. bslisowski responds with a solution, which chuckcarne attempts but reports as unsuccessful. The tone remains polite and helpful throughout. ghost chimes in with additional advice, and rudrakshkarpe provides a detailed alternative solution involving creating a virtual environment. The conversation concludes with chuckcarne expressing satisfaction with an existing solution, and the overall tone remains collaborative and informative.""",0.00
1236343221,"""The conversation begins with Kludex presenting a solution, followed by graingert asking for clarification on how it interacts with reload. Kludex responds with an example code snippet and output, attempting to demonstrate their point. The tone remains polite and informative throughout. However, the conversation takes a decisive turn when Kludex announces their intention to close the issue due to inability to reproduce it, which may be perceived as slightly abrupt.""",0.22
1236349167,"""The conversation starts with Kludex seeking confirmation on changes made to Uvicorn loggers. The tone is polite, with speakers expressing willingness to help and receive feedback. However, when euri10 expresses reservations about changing the `uvicorn.error` logger name due to its widespread use, the discussion becomes more nuanced. Some speakers, like doncatnip and alexsantos, strongly argue against keeping the current naming scheme, citing confusion and potential issues with log monitoring. Kludex initially agrees to keep the status quo but later changes their mind, reopening the PR and offering to update the documentation. The conversation remains civil throughout, with speakers engaging in a constructive debate about the merits of changing the logger name.""",0.02
1237396259,"""The conversation begins with a neutral tone, with timkofu providing information about a deprecated package. Kludex responds with a link to an ongoing pull request, which sparks a brief exchange of acknowledgement and appreciation between the two speakers. The tone remains polite and collaborative throughout, with no signs of disagreement or tension.""",0.00
1239808896,"""The conversation starts with bwhmather proposing changes to uvicorn, which florimondmanca responds to by questioning the approach and suggesting alternative solutions. The tone remains civil throughout, with both speakers engaging in a constructive discussion. Florimondmanca expresses concerns about documentation and suggests that the proposed changes should be part of a larger effort to refine the API for running uvicorn programmatically. Bwhmather provides context on their use case and explains how the proposed changes would improve their workflow. The conversation concludes with adriangb expressing support for the idea of developing better APIs for running uvicorn programmatically.""",0.00
1242217533,"""The conversation begins with a straightforward proposal by neolit123, which is met with a neutral response from k8s-ci-robot. The tone remains civil and collaborative throughout, with participants using polite language and following established protocols. pacoxu and sftim engage in a brief discussion about priority labels, but the exchange is respectful and focused on the topic at hand. reylejano's approval of the proposal marks a turning point in the conversation, after which the tone shifts to one of confirmation and finalization. The conversation concludes with a series of automated messages from k8s-ci-robot and netlify[bot], which provide updates on the status of the proposal.""",0.00
1242222547,"""The conversation begins with a bug report from neolit123, who presents a problem and proposed solution. The tone is neutral and informative. k8s-ci-robot responds with a standard message, providing instructions for triage and labeling. neolit123 then adds labels to the issue, including `/sig cluster-lifecycle` and `/priority important-soon`, indicating a sense of importance and urgency. Finally, neolit123 CC's @tengqm, bringing them into the conversation. The overall tone remains polite and collaborative throughout.""",0.00
1242283358,"""The conversation starts with a polite correction and a sharing of information, followed by automated responses from bots. The tone remains neutral and technical until a user expresses approval for a pull request, triggering a bot to confirm the approval. Throughout the conversation, the tone stays civil and focused on the topic at hand, with no signs of disagreement or tension.""",0.00
1242360914,"""The conversation begins with automated messages from netlify[bot] and k8s-ci-robot, providing updates on the pull request. The tone is neutral and informative. As human participants join the conversation, the tone remains polite and collaborative. Arhell assigns tasks to atoato88 and nasa9084, who respond with approval and LGTM labels. The conversation is efficient and focused on the task at hand, with no signs of conflict or tension. Overall, the tone remains professional and courteous throughout.""",0.00
1245113152,"""The conversation begins with staabm describing an issue with composer scripts and xdebug timeouts. Seldaek responds by providing a possible solution and suggesting a new config setting to allow longer execution times for scripts. The tone remains polite and collaborative, with Seldaek considering the idea and weighing its feasibility. However, after further consideration, Seldaek decides that implementing the change is not reasonable and suggests using a workaround instead. The conversation ends with staabm thanking Seldaek for their time and effort.""",0.00
1246145167,"""The conversation starts with Seldaek sharing an image showing poor coverage of Command classes and inviting others to contribute. Multiple users express their willingness to help, and some even start working on specific commands. The tone remains collaborative and encouraging throughout the conversation. As users share their progress and updates, Seldaek provides feedback and guidance, helping to keep everyone on track. The conversation is marked by a sense of camaraderie and shared purpose, with users working together to improve test coverage. The tone remains positive and supportive, even as some users encounter challenges or wait for feedback on their pull requests.""",0.00
1246293810,"""The conversation starts with GuySartorelli presenting a new feature and seeking feedback. The tone is polite and collaborative, with other speakers offering suggestions and ideas for improvement. As the conversation progresses, some minor disagreements arise, but they are addressed in a constructive manner. The discussion remains focused on the topic at hand, with speakers building on each other's ideas and providing additional context. The tone remains civil throughout, even when addressing technical issues or potential problems. Eventually, the feature is merged, and the conversation shifts to discussing potential future enhancements and related projects.""",0.05
1247089616,"""The conversation starts with a neutral tone as staabm tests a new phpstan-dba feature and shares the results. private-packagist[bot] provides updates on the composer.lock diff comment. stof joins the conversation, providing feedback on the reported issues, suggesting that having indexes for everything might have drawbacks. staabm thanks stof for the feedback and implements changes to ignore derived tables and add a threshold to prevent false positives. The tone remains polite and collaborative throughout the conversation, with participants engaging in constructive discussion and providing helpful insights.""",0.00
1248043592,"""The conversation starts with jakubboucek describing an issue they're experiencing and providing detailed information to support their claim. pscheit responds by sharing a similar experience and offering help to debug, initially expressing confusion but later discovering the source of the problem through research. The tone remains collaborative and helpful throughout, with pscheit eventually finding a solution and sharing it with jakubboucek. webmozart briefly joins the conversation, expressing frustration with the issue, but quickly resolves their own problem and edits their message to reflect this. Seldaek finally chimes in, providing a definitive solution by referencing an upcoming release that will fix the issue.""",0.04
1248670667,"""The conversation begins with tiegz pointing out an inconsistency between two sources of information, which prompts stof to provide clarification and redirect them to more up-to-date documentation. The tone remains polite and helpful throughout, with stof offering additional reassurance and confirmation in response to tiegz's follow-up questions. The conversation unfolds smoothly, with each speaker building on the other's responses to resolve the initial issue.""",0.00
1248884650,"""The conversation starts with madebr introducing a PR for adding Visual Studio development releases and component support, which triggers a discussion on how to structure the cmake files. Slouken suggests creating separate directories for each platform, while madebr proposes using a 'pkg-support' folder. The conversation becomes more technical as they discuss the details of cmake configuration and framework setup on Apple platforms. Madebr makes several changes based on slouken's feedback, including adding COMPONENT support and fixing issues with SDL2_INCLUDE_DIR. Eventually, they reach a working solution, and slouken suggests adding documentation to pkg-support. The tone remains collaborative throughout, with both speakers providing constructive feedback and suggestions.""",0.00
1249323705,"""The conversation begins with GuySartorelli describing an issue they are experiencing and glaubinix responding with a request for clarification. The tone remains polite and collaborative throughout, with both speakers working together to troubleshoot the problem. As the conversation progresses, glaubinix provides feedback on GuySartorelli's code, pointing out specific errors and suggesting corrections. GuySartorelli acknowledges the mistakes and expresses gratitude for the help, leading to a resolution of the issue. The overall tone remains friendly and helpful, with no signs of tension or conflict.""",0.00
1249619017,"""The conversation begins with hwjsnc describing an issue and identifying the responsible commit. slouken responds by explaining the cause of the problem, which leads to a discussion about potential solutions. The tone remains civil throughout, with speakers providing additional information and context to support their arguments. madebr joins in, suggesting a possible fix and asking for testing, which hwjsnc eventually confirms as working. Overall, the conversation is collaborative and focused on resolving the issue at hand.""",0.01
1249653194,"""The conversation starts with fjtrujy sharing their progress on a Playstation 2 port of SDL and seeking suggestions for addressing an infinite loop issue. The discussion remains civil, with speakers building off each other's arguments and providing clarifications. sezero asks a question about the limitation of MIPS cpu in PS2, which fjtrujy answers politely. icculus suggests implementing atomics with standard operations, which fjtrujy agrees with and explains further. cgutman questions fjtrujy's assertion about native atomic support on PS2, but later concedes after finding evidence to contradict their claim. The conversation concludes with icculus asking if the issue can be closed, but fjtrujy requests to keep it open until they complete a pending PR.""",0.00
1249743298,"""The conversation begins with smcv introducing a technical topic and proposing a change, which is met with a neutral tone. sezero then responds with a concern about compatibility, expressing frustration through an error message. madebr enters the conversation to provide clarification and offers a solution, which is acknowledged by sezero. The tone remains polite and collaborative throughout, with speakers working together to find a resolution. The conversation concludes with madebr providing a fix, marking a positive outcome.""",0.00
1252276768,"""The conversation begins with GuySartorelli pointing out a discrepancy between documentation and implementation, which sparks a polite discussion. stof responds with a suggestion to update the documentation, indicating agreement with GuySartorelli's observation. GuySartorelli then provides additional context and clarification on the issue, citing specific code references. The tone remains collaborative throughout, with no signs of tension or disagreement.""",0.00
1255635149,"""The conversation begins with maximmandrik describing an error they encountered while executing a command. greg0ire responds by requesting more information, specifically a stack trace. fd6130 then offers a potential solution, providing a workaround to disable foreign key constraints. bobvandevijver joins the conversation, suggesting an alternative approach using a truncate flag, but also shares their own experience of solving the issue with a custom purger. Throughout the conversation, the tone remains helpful and collaborative, with each speaker building on the previous suggestions to provide a solution.""",0.00
1260725718,"""The conversation begins with LiamKearn suggesting an improvement and offering to make a pull request. Seldaek responds neutrally, providing some context but not expressing strong opposition or enthusiasm. LiamKearn shares his personal experience and frustration with the current implementation, using humor to lighten the tone. The conversation takes a turn when stof intervenes, attempting to close the discussion by stating that the issue has already been implemented, which may come across as slightly abrupt.""",0.23
1261020039,"""The conversation starts with LiamKearn expressing caution about a potential issue and Seldaek responding positively. However, staabm then reports that the intended functionality is not working for them, leading to a series of troubleshooting questions from LiamKearn. The tone remains polite and collaborative throughout. As the discussion progresses, stof suggests an alternative approach, which Seldaek acknowledges as correct after initially defending their original decision. Staabm provides further evidence to support stof's suggestion, and Seldaek eventually confirms the issue and commits a fix. The conversation concludes with staabm confirming that the fix resolves the problem.""",0.00
