issue_id,summary,possibility_toxic
724771238,"""The conversation starts with a user, gergesh, proposing an idea and seeking feedback on its feasibility. The tone is polite and exploratory. Another user, theScrabi, responds with questions and encouragement, maintaining a supportive atmosphere. However, as gergesh delves deeper into the details of the proposal, they express doubts about its worthiness due to limitations. The conversation remains civil but becomes more subdued, ultimately trailing off without a clear resolution or further discussion.""",0.05
725804743,"""The conversation begins with a straightforward discussion about addressing a deprecation issue. landongrindheim presents their solution and invites feedback from others. The tone remains polite and collaborative throughout, with speakers building on each other's ideas and engaging in constructive debate. As the conversation progresses, deivid-rodriguez suggests an alternative approach that gains traction, leading to a shift in the discussion towards exploring this new direction. The overall tone remains civil and focused on finding the best solution, with speakers showing appreciation for each other's input and insights.""",0.00
729735095,"""The conversation starts with enoch85 describing an issue and providing detailed steps to reproduce it. alandekok responds by explaining the potential cause of the problem and suggesting a solution, but also shifts the blame to Ubuntu, implying that the issue is not with FreeRADIUS. The tone remains polite, but slightly defensive on alandekok's part. enoch85 thanks the respondents and decides to try again with official packages. Later, enoch85 asks about support for Focal and receives a helpful response from jpereira. The conversation ends with enoch85 successfully installing from source and expressing gratitude.""",0.08
739501498,"""The conversation begins with a neutral tone, with users discussing the status of a pull request. arr2036 expresses a need for further work on the decoder, while alandekok suggests separating the code into smaller parts. The discussion remains polite and focused on the topic at hand. However, as the conversation progresses, jpereira's response to alandekok's suggestion is somewhat defensive, indicating a slight increase in tension. Nevertheless, the tone remains civil, with users continuing to discuss and clarify their points of view. Ultimately, the conversation concludes with a plan for future action, maintaining a collaborative and constructive atmosphere throughout.""",0.05
740577094,"""The conversation begins with a polite and welcoming tone, as carsonbot greets brusch on their first PR and provides guidance on Symfony's contribution process. The discussion remains civil and informative, with fabpot asking for use cases and brusch providing a clear explanation of their intentions. Throughout the conversation, the speakers maintain a collaborative and respectful attitude, with no signs of tension or conflict.""",0.00
740634999,"""The conversation starts with a detailed report of an issue, including steps to reproduce and possible solutions. The tone is informative and neutral. Carsonbot responds with polite inquiries about the relevance and status of the bug, showing concern for the conversation's stagnation. Ybenhssaien replies briefly, acknowledging the open pull request and expressing intention to investigate further. Throughout the conversation, the tone remains civil and collaborative.""",0.00
740640179,"""The conversation starts with ybenhssaien presenting a proposal, which is met with skepticism by nicolas-grekas. nicolas-grekas expresses concerns about breaking existing apps and suggests that the change should be treated as a new feature. ybenhssaien agrees to update their pull request accordingly. However, fabpot abruptly shuts down the conversation, expressing their lack of conviction in the proposed change. The tone remains technical and focused on the issue at hand, with no personal attacks or emotional appeals.""",0.13
740669717,"""The conversation starts with Microtribute suggesting an idea to simplify service injection using `@Autowired` annotation, which sparks a discussion on its feasibility and potential drawbacks. Michaljusiega provides information on existing annotations, while derrabus offers alternative solutions and expresses concerns about the proposed feature. The tone remains civil throughout, with speakers engaging in a constructive debate. As the conversation progresses, xabbuh joins in to agree with derrabus' reasoning, ultimately leading to a collective decision against adding the proposed feature.""",0.00
741133193,"""The conversation starts with a neutral tone as arr2036 suggests using 'apt-fast' to parallelize downloads. terryburton responds by providing data showing that data transfer is already quite fast, but arr2036 remains optimistic about the benefits of using 'apt-fast', citing reduced install time and saved bandwidth. The conversation remains civil and collaborative throughout.""",0.00
743915262,"""The conversation begins with terryburton introducing a new workflow, which is met with a neutral response from arr2036. However, arr2036 soon expresses skepticism about the workflow's capabilities, specifically questioning its support for C files. terryburton acknowledges this limitation, but frames it as a minor issue and highlights the benefits of the workflow in detecting issues with other file types. The tone remains polite and collaborative throughout, with both speakers engaging in a constructive discussion.""",0.05
767087029,"""The conversation starts with memeplex describing an issue and providing code examples to illustrate the problem. As the discussion progresses, memeplex becomes increasingly frustrated with the behavior of the `shlex` module, questioning its design decisions and pointing out inconsistencies. MrMino enters the conversation, offering a sympathetic ear and acknowledging that the issue might be a bug. The tone remains technical and focused on solving the problem, but with an undercurrent of mild annoyance and skepticism towards the `shlex` module's behavior.""",0.17
770039478,"""The conversation begins with skalaydzhiyski presenting a feature and its usage, followed by MrMino questioning whether it's a duplicate of another issue. Skalaydzhiyski acknowledges the duplication and takes action to resolve it, showing a collaborative tone. The conversation then shifts to Carreau apologizing for a delay in reviewing and expressing appreciation for the work done, maintaining a polite and appreciative atmosphere throughout.""",0.00
772226105,"""The conversation starts with GasinAn expressing frustration about an issue they're experiencing with Ipython. MrMino responds with a polite and helpful tone, asking if the issue is still present and suggesting a potential solution. The conversation remains civil and collaborative throughout, with both speakers exchanging information and assistance. As the conversation progresses, it becomes clear that the issue has been resolved, and the tone shifts to one of mutual appreciation and closure. MrMino even redirects the conversation to a duplicate issue thread, showing a willingness to keep the discussion organized and efficient.""",0.00
774658458,"""The conversation begins with farisachugthai pointing out issues with a code repository. Carreau responds briefly and dismissively, which is met with a neutral and informative response from lumberbot-app[bot]. The tone remains polite and helpful throughout, with lumberbot-app[bot] providing detailed instructions to resolve the issue. There are no signs of tension or conflict, and the conversation proceeds in a collaborative and constructive manner.""",0.00
785539756,"""The conversation starts with a technical discussion between MicaelJarniac and Kavya9986, who expresses interest in contributing to the open-source project. MarcoGorelli provides guidance and clarifies the status of the issue. As the conversation progresses, karthik200116 joins in, but is politely told that someone is already working on the issue. Kavya9986 continues to work on the issue and eventually submits a pull request, which they repeatedly ask MarcoGorelli to review. The tone remains polite and collaborative throughout, with a sense of enthusiasm and eagerness from the new contributors.""",0.00
785540082,"""The conversation begins with a polite tone, as MicaelJarniac expresses gratitude for feedback on their PR and acknowledges the need for further investigation. The discussion remains civil, with simonjayhawkins providing helpful insights and suggestions. However, the tone shifts slightly when jreback closes the issue, which could be perceived as abrupt. Nevertheless, the conversation ends on a collaborative note, with jbrockmendel offering assistance and MicaelJarniac expressing willingness to rebase and fix issues.""",0.13
785550073,"""The conversation starts with vdonato reporting a bug and providing a code sample. jreback responds by clarifying the issue and providing additional context. The tone remains neutral and informative throughout the conversation. As the discussion progresses, jbrockmendel joins in and agrees with jreback's assessment, citing a FutureWarning that will be raised in future versions. mroeschke then chimes in, agreeing with the others and closing the issue due to its deprecated behavior. The overall tone remains civil and collaborative.""",0.00
785606324,"""The conversation starts with jbrockmendel presenting a PR and explaining its purpose, followed by jreback giving approval to merge it after some minor adjustments. jorisvandenbossche then joins the conversation, providing feedback on the whatsnew note and pointing out potential issues with the change. The discussion remains civil and collaborative throughout, with speakers clarifying and addressing each other's concerns. As the conversation progresses, jorisvandenbossche raises additional points, including a potentially problematic aspect of the change, which leads to further discussion and clarification. Eventually, jreback suggests that jorisvandenbossche request changes before merging the PR, and jbrockmendel agrees to implement a special case to address one of the issues raised.""",0.04
791086514,"""The conversation begins with a polite exchange between julianullrich99 and SenseException, where julianullrich99 explains the purpose of their code contribution. The tone remains civil as SenseException requests additional testing to cover the changes. However, beberlei intervenes, expressing confidence in the existing tests and implying that new tests are unnecessary, which slightly shifts the tone to one of mild assertiveness.""",0.21
791351356,"""The conversation between ThomasLandauer and SenseException starts with ThomasLandauer expressing confusion about a specific topic and suggesting an improvement to a documentation page. SenseException responds politely and asks for clarification on certain points, showing interest in ThomasLandauer's suggestion. The tone remains civil throughout the conversation, with both speakers engaging in a collaborative discussion. As the conversation progresses, they delve deeper into the details of the suggested improvement, discussing potential layouts and syntax. The conversation concludes with SenseException providing guidance on how to proceed with the suggested changes.""",0.00
793722661,"""The conversation begins with plfort introducing a pull request and explaining its benefits. beberlei responds with a mix of agreement and concern, acknowledging the improvement while questioning its potential impact on composite keys. The tone remains polite and collaborative throughout. As the discussion progresses, beberlei expresses hesitation about merging the PR into a bugfix branch, citing potential risks. plfort agrees to rebase the PR on a different branch, which is done promptly. The conversation concludes with rvanlaak suggesting that an old issue can now be closed, marking a resolution to the discussion.""",0.00
794225748,"""The conversation starts with Lustmored presenting their code and tests, seeking feedback from others. The tone is polite and collaborative, with Lustmored expressing gratitude for suggestions and help. As the conversation progresses, beberlei provides constructive criticism and guidance, pointing out potential issues and offering solutions. Lustmored responds thoughtfully, acknowledging the problems and working to address them. The discussion remains civil and focused on improving the code, with both parties engaging in a back-and-forth exchange of ideas and suggestions. As the conversation nears its end, beberlei offers words of appreciation for Lustmored's efforts, and Lustmored expresses their intention to continue refining the code and addressing any remaining issues.""",0.00
805964034,"""The conversation begins with mirh reporting a bug and providing detailed steps to reproduce the issue. The tone is polite and informative, with mirh expressing frustration at the program's behavior. kevinushey responds helpfully, filing an associated issue and explaining that the problem lies with the `rmarkdown` package. mirh thanks kevinushey for their response and expresses some skepticism about the program's behavior. yihui then chimes in to announce that the issue has been fixed in the development version of **rmarkdown**, which brings a sense of closure to the conversation. Throughout, the tone remains civil and collaborative.""",0.00
806402033,"""The conversation starts with a polite and detailed report of an issue by matthew-law, followed by a supportive response from ronblum. However, as the conversation progresses, jjallaire's responses become increasingly defensive and dismissive, leading to a sense of frustration and disappointment among other participants. The tone remains professional but tense, with a sense of urgency and concern for resolving the issue. Ultimately, the conversation ends with a sense of resignation and acceptance that the issue may not be fixed in the current release.""",0.42
806517131,"""The conversation starts with ermueller describing a problem they are experiencing with RStudio and providing detailed steps to reproduce the issue. The tone is polite and informative, with ermueller showing frustration at not being able to resolve the issue despite trying various solutions. ronblum responds with appreciation for ermueller's investigation and promises to review the issue as part of ongoing development. kevinushey asks follow-up questions in an attempt to reproduce the issue, but is unable to do so. The conversation remains civil throughout, with users showing a willingness to help and collaborate. The tone shifts slightly when github-actions[bot] intervenes to mark the issue as stale and eventually closes it due to inactivity.""",0.02
806782866,"""The conversation starts with jmcphers describing a problem and proposing a solution, but then takes a turn as they express frustration and confusion about the issue. The tone remains polite and technical throughout, but jmcphers' language becomes increasingly defensive and self-justifying as they respond to their own concerns and questions. Despite this, the conversation remains focused on the topic at hand, with jmcphers providing additional examples and explanations to clarify their points. Ultimately, the conversation concludes with jmcphers deciding to move the issue out of a specific project due to limitations in R's garbage collection mechanism.""",0.12
822134836,"""The conversation begins with a query from lhog, which is met with a response from sprunk that expresses uncertainty. The tone remains polite and collaborative throughout. sprunk's admission of uncertainty prompts lhog to seek clarification on decision-making authority, deferring to Kloot's expertise. rtri then joins the conversation, offering reassurance and providing guidance on procedure, effectively calming any concerns and bringing the discussion to a close with a sense of resolution.""",0.00
822814509,"""The conversation starts with SerlokPK describing an issue they're experiencing. Cheesebaron responds with confusion and requests more information, while also offering a potential explanation. tbalcom then jumps into the conversation, providing a solution to the problem. SerlokPK acknowledges tbalcom's suggestion as correct and mentions that it has resolved their issue. The tone of the conversation remains polite and helpful throughout.""",0.00
830064677,"""The conversation starts with CatsLeftEar proposing a feature and providing context, followed by github-actions[bot] notifying that the issue is stale. The tone remains neutral until Autowinto and YannickMG join the discussion, expressing support for the idea and sparking a collaborative atmosphere. However, the conversation takes a slightly defensive turn when CatsLeftEar questions why someone might not like the feature, but overall the discussion remains civil and focused on the topic at hand.""",0.04
830285557,"""The conversation starts with Sphyix expressing frustration about pollution in the game and requesting that it be turned off on official servers until a rework is implemented. basdxz responds sarcastically, but Sphyix clarifies their request and emphasizes its temporary nature. The discussion becomes more constructive as Prometheus0000 and dvdmandt join in, with dvdmandt sharing information about their ongoing work to revamp the pollution system. boubou19 and Leche-Caliente share their experiences with pollution, and azunaVT provides a detailed argument for why pollution should be disabled on official servers, citing its negative impact on gameplay and creativity. The tone of the conversation remains civil, with participants engaging in a respectful discussion about the issue at hand.""",0.04
830331805,"""The conversation begins with rv-jgentile reporting an issue and providing detailed information, followed by Dream-Master acknowledging the problem and expressing a willingness to fix it. Prometheus0000 chimes in with some investigation of their own, sparking a brief discussion about potential causes. The tone remains polite and collaborative throughout, with Dream-Master explaining the reason behind the issue and rv-jgentile even submitting a pull request to try and fix it. However, rv-jgentile ultimately closes the PR due to lack of familiarity with the codebase, ending the conversation on a note of humility and recognition of one's own limitations.""",0.00
851462743,"""The conversation starts with winstonpang seeking guidance on implementing iOS 14's new UISplitViewController features. Cheesebaron responds with a suggestion, but acknowledges not having looked into it themselves. The tone remains polite and helpful throughout. Hackmodford joins the conversation, suggesting that updating MvvmCross might be necessary to handle the third pane. ivmirx provides more information on the limitations of the current implementation and suggests subclassing the existing presenter. winstonpang shares their prototype code, which works semi-correctly, but still has issues with navigation in the Secondary column. The conversation remains collaborative and focused on finding a solution.""",0.00
855390932,"""The conversation between comediebenji and amtriathlon starts with a polite tone, as amtriathlon thanks comediebenji for their contribution. However, the discussion quickly turns into a constructive criticism, with amtriathlon pointing out several issues with comediebenji's pull request. Comediebenji responds apologetically and defensively, acknowledging some mistakes and agreeing to make changes. The tone remains civil throughout, but with a hint of frustration from both sides as they discuss the technical details. As the conversation progresses, amtriathlon becomes more assertive in their guidance, providing links to documentation and emphasizing the need for further testing. Comediebenji continues to respond cooperatively, agreeing to make changes and close the current pull request. Overall, the tone remains collaborative, but with a sense of tension underlying the technical discussion.""",0.12
860686889,"""The conversation begins with comediebenji pointing out a potential issue and amtriathlon responding with a suggested solution. The tone remains polite and collaborative throughout, with both speakers engaging in a constructive exchange of ideas. Comediebenji acknowledges amtriathlon's suggestion and agrees to make the change, while amtriathlon provides additional guidance on implementing the solution. The conversation concludes with comediebenji confirming that the necessary steps are already being taken.""",0.00
865023334,"""The conversation begins with AMDmi3 providing a solution to make PCG32 compatible with C++ UniformRandomBitGenerator. sprunk responds with an error message, which prompts AMDmi3 to clarify that the issue was due to a patch against an older version. The tone remains polite and collaborative throughout, with abma expressing gratitude for the fix.""",0.00
868837666,"""The conversation begins with markuspalme describing an issue they are experiencing, seeking help from others. Cheesebaron responds with clarifying questions, and markuspalme provides additional details. The tone remains polite and collaborative throughout. As the conversation progresses, markuspalme becomes more self-reflective, eventually identifying the root cause of the issue as a mistake on their own part. Cheesebaron offers supportive feedback, and the conversation concludes with a sense of resolution and mutual understanding.""",0.00
870218880,"""The conversation starts with stefano-xy proposing an idea, which is met with a neutral response from Falke-Design. The tone remains polite as tobiasso85 shares their similar experience and provides a potential solution, showing enthusiasm and appreciation for the possibility of extending the functionality. ppete2 then joins in, expressing support for the feature request and emphasizing its importance. Throughout the conversation, the speakers maintain a collaborative and respectful tone, with no signs of disagreement or tension, creating an efficient and productive discussion.""",0.00
872435276,"""The conversation begins with iamjones2 seeking help with a technical issue, to which amtriathlon responds politely but firmly, explaining the group's moderation policy. iamjones2 expresses frustration at the delay, prompting amtriathlon to clarify the group's purpose and boundaries. The tone remains civil, with amtriathlon maintaining a neutral and informative stance, while iamjones2's messages convey growing impatience.""",0.24
872658458,"""The conversation begins with Falke-Design sharing a fix for a bug and providing a demo link. johnd0e responds with a tone of skepticism, questioning the relevance of the provided link and requesting additional information. The tone remains polite but critical as johnd0e asks for further clarification and unit tests. Falke-Design accommodates these requests, adding a plunkr and tests. The conversation takes a turn when johnd0e suggests an alternative solution, which sparks a discussion with mourner about the usefulness of allowing certain option combinations. The tone remains civil and collaborative throughout, with speakers engaging in constructive debate and offering suggestions.""",0.04
873231643,"""The conversation begins with edemattia reporting an issue and amtriathlon responding dismissively, directing them to read the FAQs and use the user forum before opening issues. Edemattia politely pushes back, stating they had already searched the forums and didn't find anything related to their issue. Amtriathlon then provides a link to a relevant FAQ entry, which edemattia appreciates, leading to a conciliatory tone at the end of the conversation.""",0.07
875245201,"""The conversation starts with a neutral tone as Dependabot and SonarCloud bots provide updates on the project's dependencies and quality gate status. The tone remains civil throughout, with no signs of conflict or strong emotions. There are no instances of personal attacks, blame, or accusations. The conversation is purely informative, with the bots providing updates and Cheesebaron responding with a polite command to close the conversation.""",0.00
877792434,"""The conversation starts with JonatanRydh pointing out a potential issue in Draggable.js, which johnd0e responds to by questioning the circumstances under which the issue occurs. The discussion becomes more collaborative as JonatanRydh provides additional context and debugging information, leading to a deeper understanding of the problem. However, when johnd0e suggests that JonatanRydh should propose a pull request to fix the issue, the tone shifts slightly, with johnd0e coming across as somewhat directive. The conversation remains civil, but with a hint of frustration from JonatanRydh, who is unsure about how to proceed with fixing the issue. psimonazzi's late entry into the conversation adds another perspective on the problem and suggests that making the check more robust would be beneficial.""",0.23
878659180,"""The conversation starts with SuperPat45 reporting a bug in Leaflet and providing detailed steps to reproduce the issue. The tone is neutral and informative. johnd0e responds with a suggestion, which is polite and helpful. Falke-Design then attempts to reproduce the error but fails, leading to a slightly skeptical tone. However, after SuperPat45 confirms that they can no longer reproduce the issue with the latest version of Firefox, Falke-Design's tone becomes appreciative and thankful. The conversation remains civil throughout, with each participant contributing constructively to the discussion.""",0.00
