issue_id,summary,possibility_toxic
314117541,"""The conversation begins with micgro42 explaining a bug fix and its reasoning. splitbrain responds with a suggestion for testing, which micgro42 politely declines while providing a detailed explanation and referencing an RFC document to support their argument. The tone remains civil and informative throughout, with micgro42 showing a willingness to consider alternative scenarios and even opening an issue upstream to address the problem.""",0.00
314419373,"""The conversation begins with selfthinker explaining their reasoning behind fixing invalid HTML, which is met with appreciation from micgro42. The discussion remains civil as they delve into the semantics of search results pages, with both speakers expressing their thoughts on the matter. As the conversation progresses, splitbrain joins in and provides additional insights, leading to a collaborative exchange of ideas. Throughout the discussion, the tone remains polite and constructive, with speakers building upon each other's points and engaging in a respectful debate. The conversation concludes with selfthinker summarizing the remaining tasks and micgro42 providing a heads-up on recent changes made to the pull request.""",0.00
316630309,"""The conversation begins with turnermm introducing a new code issue and kvnyang sharing their personal experience with the error. selfthinker provides a solution by pointing out that the plugin needs an update, which is met with some skepticism from turnermm. However, tmo26 confirms that updating the plugin solves the issue, although it initially doesn't show up as updatable. The tone remains polite and collaborative throughout, with micgro42 eventually resolving the issue by updating the plugin's version number, leading to a positive conclusion.""",0.00
316651213,"""The conversation begins with a series of neutral and informative comments, with each speaker providing additional context and references. The tone remains polite and collaborative throughout, with speakers building on each other's points and providing helpful information. There is no apparent disagreement or tension, and the conversation unfolds as a constructive exchange of ideas.""",0.00
322339244,"""The conversation begins with asaarilahti proposing a change and seeking feedback from slandelle. Slandelle responds with a mix of technical explanations and advice, which asaarilahti acknowledges and clarifies their use case. The tone remains polite and collaborative throughout. As the discussion progresses, asaarilahti becomes increasingly uncertain about the usefulness of the proposed change for the general user base, leading to a concession and eventual closure of the conversation with slandelle's agreement.""",0.05
323775442,"""The conversation starts with jes reporting an issue with Mojolicious' handling of certificate verification and proposing a change. kraih responds by explaining the current behavior is intentional for testing purposes, but not considered a bug. The tone remains civil, with both sides presenting their perspectives. As the discussion progresses, jberger and shadowcat-mst join in, acknowledging the value of changing the default behavior to secure-by-default, but also highlighting the difficulties in implementing such a change. The conversation shifts from disagreement to collaboration, with all parties encouraging jes to create a proposal for the change. The tone remains constructive, with participants offering guidance and support for making the proposed changes.""",0.00
324052074,"""The conversation starts with sventorben suggesting a change and slandelle expressing gratitude but also questioning the necessity of the change. The tone remains polite, with both speakers providing explanations and counterarguments. As the discussion progresses, sventorben becomes more assertive, emphasizing the importance of their proposed solution, while slandelle maintains a cautious stance, highlighting potential implementation difficulties. The conversation ends with slandelle discouraging the suggested change, citing complexity and suggesting an alternative solution.""",0.07
324276129,"""The conversation begins with qyz describing a problem they are experiencing with Mojo::DOM and providing steps to reproduce the behavior. kraih acknowledges that this is a bug in the new DOM tree cloning code and provides a potential fix, which qyz confirms works for their test case. The tone of the conversation remains polite and collaborative throughout, with both speakers expressing gratitude and appreciation for each other's input.""",0.00
324307231,"""The conversation begins with brandshaide describing a technical issue they are experiencing with Gatling. slandelle responds with helpful information about the default behavior of Gatling 2.3 and the upcoming changes in Gatling 3.0. The tone remains polite and collaborative throughout the conversation, with both speakers expressing gratitude for each other's support. brandshaide asks follow-up questions to clarify the solution, and slandelle provides clear and concise answers. As the conversation progresses, brandshaide considers submitting a pull request to address the issue, but slandelle advises that it is not necessary since the behavior will be changed in Gatling 3.0.""",0.00
324615930,"""The conversation starts with jes proposing a change to enable SSL verification by default and kraih responding with constructive criticism, pointing out overlooked areas and potential issues. The tone remains polite and collaborative throughout. Kraih's feedback is detailed and helpful, but also expresses some concerns about the impact of the change on certain systems. Jes acknowledges and appreciates kraih's input, and the conversation continues with a focus on refining the proposal. However, kraih later reveals that the patch causes issues with HTTPS requests on certain platforms, which introduces a note of tension into the discussion. Despite this, the tone remains civil and focused on finding a solution.""",0.05
327361942,"""The conversation begins with anparker presenting a proposal and kraih providing context for their recommendation. The tone remains polite and collaborative, with kraih expressing enthusiasm for the proposal and calling for a formal vote. Kraih's review of the code is positive, and they offer constructive suggestions for further improvement. However, the conversation takes a turn when kraih reveals that the change had to be reverted due to an issue, introducing a note of disappointment and setback.""",0.42
329086591,"""The conversation starts with a polite tone as LilSebastian5000 reports an issue and slandelle responds with a clarification. However, as the conversation progresses, LilSebastian5000 becomes slightly defensive and frustrated, while slandelle remains calm and provides explanations. The tone shifts to a more educational one as slandelle clarifies the differences between 'Requests' and 'Users' and explains how the graph is computed. Throughout the conversation, both speakers engage in a back-and-forth discussion, with LilSebastian5000 seeking clarification and slandelle providing detailed responses. Overall, the tone remains civil, but with a hint of frustration from LilSebastian5000.""",0.14
337285194,"""The conversation begins with CesarVonc describing an issue and providing modifications to an example, which sparks a discussion about the intended use of `Reflector` and `Refractor`. Mugen87 and WestLangley exchange information, clarifying the usage of these features. The tone remains polite and informative, with speakers building on each other's arguments. As the conversation progresses, CesarVonc shares their observations and attempts to fix the issue, but expresses confusion about how it works. Mrdoob joins in, correcting a minor mistake and acknowledging CesarVonc's observation. Mugen87 provides insight into the algorithm behind `Reflector` and `Refractor`, explaining why supporting an arbitrary amount of planes might require a different approach. The conversation remains civil and focused on finding a solution.""",0.00
337370653,"""The conversation begins with WestLangley making a statement about code changes, followed by a polite notification to another user (@sunag). The tone remains cordial as mrdoob responds with gratitude. Throughout the conversation, the atmosphere stays calm and collaborative, with no signs of disagreement or tension.""",0.00
337557052,"""The conversation begins with donmccurdy seeking feedback from takahirox on a fix. The tone is polite and collaborative. However, when mrdoob enters the conversation, he expresses apology and gratitude, indicating a shift towards a more conciliatory tone. Overall, the conversation remains brief and cordial, with no notable escalation or tension.""",0.00
337822219,"""The conversation begins with Mugen87 introducing a new pull request and WestLangley responding with a mix of agreement and suggestions for improvement. The tone remains civil, with both speakers engaging in a back-and-forth discussion to refine the idea. WestLangley poses questions and offers alternative solutions, while Mugen87 provides explanations and justifications for their approach. As the conversation progresses, the discussion becomes more collaborative, with WestLangley acknowledging Mugen87's points and Mugen87 considering WestLangley's suggestions. The tone remains positive, with other users (mrdoob and sunag) chiming in to express appreciation and enthusiasm for the changes being discussed.""",0.00
339255201,"""The conversation starts with fabienrenaud describing an issue with the jacocoTestReport task failing when there are no tests in the src/test/java folder. marcphilipp responds by explaining how to configure the executionData property to include all *.exec files in the build/jacoco directory, and provides a code snippet to achieve this. However, fabienrenaud points out that this solution does not work for projects with custom test sets. The conversation then diverges into discussions about the JaCoCo plugin's behavior, with some users experiencing issues with overriding execution data in Gradle 6.0. Various solutions are proposed, including using getExecutionData().setFrom() instead of setExecutionData(), and creating a custom JacocoReport task to aggregate coverage reports from multiple test tasks. The conversation ends with some users reporting success with these workarounds, while others continue to experience issues.""",0.06
339456108,"""The conversation starts with leonard84 reporting an issue and providing detailed information. marcphilipp briefly assesses the problem and tags melix for further investigation. melix suspects a classloading isolation issue and notes that it requires deeper investigation, but doesn't provide an immediate solution. The tone remains polite and collaborative throughout the conversation. After a period of inactivity, stale[bot] marks the issue as stale, but leonard84 eventually reports that the problem has been fixed by a PR.""",0.02
339558213,"""The conversation starts with xenoterracide sharing their thoughts on using dependency locking to solve multiple problems. ljacomet responds by discussing the idea of ignoring dependency lock state and suggesting an alternative solution. The tone remains civil and collaborative, with both speakers engaging in a constructive discussion. However, the conversation is interrupted by stale[bot], which marks the issue as stale due to inactivity and eventually closes it. Despite this, xenoterracide expresses their continued interest in the feature, but no further discussion occurs.""",0.04
339685573,"""The conversation starts with a user reporting an issue and providing detailed information about the problem. The tone remains polite and helpful throughout the conversation. A Gradle expert, wolfs, responds by identifying the cause of the issue and offering a workaround. The original poster, aj-jaswanth, confirms that the workaround solves the problem and thanks wolfs for the help. Later, another user, marcellodesales, reports experiencing the same issue with a different version of Gradle, but wolfs' suggested workaround is again effective. A third user, XeZZoR, asks about a related issue and receives guidance from wolfs on how to improve their code. The conversation remains civil and focused on finding solutions throughout.""",0.00
352175657,"""The conversation begins with cbothner presenting a PR and explaining its purpose, followed by georgeclaghorn providing feedback on commit organization and suggesting separate changelog entries. The tone remains polite and collaborative throughout. cbothner addresses georgeclaghorn's suggestions and asks about handling errors in RepresentationsController for developer experience. georgeclaghorn explains the current behavior of the DebugExceptions middleware and expresses uncertainty about how to improve it, but decides to merge the PR while considering further improvements.""",0.00
352177721,"""The conversation begins with cbothner suggesting a change to the Azure gem, which is met with a polite response from rails-bot providing guidelines for the pull request process. The tone remains civil as georgeclaghorn requests a rebase and later discovers an issue with the tests, leading to a temporary revert of the changes. cbothner apologizes for the oversight and provides additional information about the error types, sparking a discussion about how to proceed. Throughout the conversation, the speakers maintain a collaborative tone, with cbothner offering alternatives and georgeclaghorn providing guidance on next steps. The conversation concludes with georgeclaghorn requesting a new pull request with specific changes.""",0.01
352264316,"""The conversation starts with a polite tone, as al2o3cr explains the purpose of their pull request and acknowledges potential issues. However, the discussion takes a turn when kamipo expresses skepticism about the need for column order linting, leading to a series of back-and-forth exchanges between al2o3cr and kamipo. matthewd joins the conversation, initially agreeing with kamipo but later becoming more sympathetic to al2o3cr's perspective. The tone remains civil throughout, with speakers engaging in a nuanced discussion about the trade-offs between different approaches. Ultimately, the conversation concludes with eileencodes mentioning that they handled the issue at GitHub by deleting old migrations.""",0.07
352311498,"""The conversation starts with jonathan-wheeler presenting a pull request and providing benchmark results, which sparks a discussion with matthewd about the expected behavior of retained memory. The tone remains polite and collaborative throughout, with both parties seeking clarification and offering explanations. However, as the conversation progresses, rails-bot intervenes to remind the participants of the contribution guidelines and later marks the pull request as stale due to inactivity. Ultimately, jonathan-wheeler decides to close the pull request, citing minimal gains and potential added complexity.""",0.05
355385564,"""The conversation starts with siebenmann describing an issue with ZFS snapshot automounts becoming inaccessible after unmounting, and loli10K attempting to reproduce the problem but failing. The discussion continues with siebenmann providing more details and testing different scenarios, while loli10K investigates the cause of the issue and discovers that it is related to the `unshare` binary and its handling of mount namespaces. The conversation concludes with loli10K explaining the root cause of the issue and suggesting a possible solution, and siebenmann confirming that the problem still exists in a test environment.""",0.05
355578053,"""The conversation starts with Redsandro describing an issue they are experiencing and seeking help, to which rincebrain responds by pointing out that the packaging hasn't been updated in 3 years and suggests that the question would be better suited for a mailing list or IRC. Redsandro then provides more information and eventually finds a solution, which they share along with additional context and suggestions for improving the documentation. The tone of the conversation remains polite and helpful throughout, with no signs of frustration or aggression.""",0.00
355735509,"""The conversation begins with a proposal and explanation by behlendorf, followed by testing results from richardelling that support the proposal. The tone remains civil and collaborative throughout, with behlendorf expressing gratitude for the speedy testing results and providing additional context. codecov[bot] provides a report on the code coverage, which is acknowledged by behlendorf. The conversation concludes with behlendorf closing the issue, stating that it doesn't address the root cause and requires further investigation.""",0.00
355761141,"""The conversation begins with a polite and informative tone, as behlendorf explains their proposed fix for an issue. sdimitro responds with a clarifying question, which behlendorf answers helpfully. The conversation remains civil and collaborative throughout, with both speakers expressing gratitude and appreciation for each other's input. A minor tangent arises when codecov[bot] interrupts with a report, but the discussion quickly refocuses on the original topic. Overall, the tone of the conversation is professional, respectful, and solution-focused.""",0.00
362900347,"""The conversation starts with a user, jumbi77, reporting an issue with their ZFS setup and providing detailed system information and error logs. The tone is neutral and informative. Another user, kpande, responds briefly to acknowledge the report. jumbi77 then asks for clarification on the implications of the error message, expressing concern about data integrity. behlendorf reassures jumbi77 that the data will always be written safely, explaining that the warning is advisory and useful for debugging. The conversation remains polite and technical throughout, with bunder2015 adding a minor clarification at the end.""",0.02
363298070,"""The conversation starts with GregorKopka presenting their code changes for compatibility with python 3. The tone is neutral and informative. Behlendorf responds by mentioning the need to reconcile the changes with another user's work, introducing a note of caution. Codecov[bot] then provides a report on the code coverage, which is factual and objective in tone. GregorKopka acknowledges behlendorf's comment and closes the conversation, expressing a slight sense of forgetfulness but overall remaining polite and cooperative.""",0.00
363314678,"""The conversation starts with ryao describing an issue they encountered and providing technical details to support their claim. trisk responds with a possible explanation, which ryao refutes by providing additional information. richardelling then suggests a potential solution, which ryao acknowledges but also points out the limitations of the approach. The conversation continues with alek-p suggesting a possible duplicate issue and ryao explaining why they think it's different. Throughout the conversation, the tone remains technical and collaborative, with participants building on each other's ideas and providing constructive feedback. However, as the conversation progresses, ryao becomes increasingly assertive in their views, emphasizing the need for a more fundamental change to address the issue. The conversation eventually trails off without a clear resolution, with stale[bot] marking the issue as ""stale"" due to lack of activity.""",0.13
367047600,"""The conversation begins with lunagloaming reporting an issue with @mentions in comments, which Flaburgan responds to by explaining the current limitations and design decisions behind them. Lunagloaming provides a use case where they would like to mention someone in a comment on a limited post, but goobertron counters that this would compromise the original poster's intent and privacy settings. The tone remains polite and informative throughout, with Flaburgan and goobertron providing explanations and links to relevant discussions. As the conversation progresses, denschub intervenes to clarify that this is not a bug, but rather a design decision, and suggests taking the discussion to Discourse for further debate.""",0.05
367593997,"""The conversation starts with HankG introducing a feature request and proposing a solution, which is met with agreement and suggestions from Flaburgan. The tone remains collaborative and polite throughout, with both speakers engaging in a constructive discussion to improve the feature. As the conversation progresses, HankG shares updates on their progress and seeks feedback from others, including Siedlerchr who joins the conversation later. The overall tone remains civil and focused on finding solutions, with no notable conflicts or tensions arising.""",0.00
367757051,"""The conversation starts with VitorRibeiroCustodio's proposal for fixing a function, which is met with skepticism by jhass and CSammy. The tone remains polite but inquiring, with speakers seeking clarification on the necessity of the fix. HankG joins the conversation to provide additional context and confirm that the issue does not affect the UI. As the discussion progresses, denschub expresses frustration at the lack of response from VitorRibeiroCustodio, leading to a slight escalation in tone. The conversation ends with denschub's comment, which can be seen as a gentle rebuke, leaving the proposal's fate uncertain.""",0.23
367873152,"""The conversation begins with a series of brief, affirmative exchanges between HankG and jeremyf. The tone remains polite and collaborative throughout. HankG then seeks clarification on the status of their code changes, expressing mild confusion and curiosity. denschub responds by merging the pull request, effectively resolving the discussion without any notable tension or conflict.""",0.00
376883482,"""The conversation begins with herwinw introducing a patch and alandekok responding positively but cautiously. The tone remains collaborative as herwinw shares test results and arr2036 joins in, agreeing on the need for selective enabling of new behavior. The discussion continues with a focus on implementation details, such as adding config options and ensuring backwards compatibility. Throughout the conversation, the speakers maintain a civil and cooperative tone, with no notable conflicts or tensions arising.""",0.00
378091553,"""The conversation starts with MisterErwin suggesting to add Python 3 support for the rlm_python module, which sparks a discussion among multiple users about the feasibility and implementation of this feature. Herwinw shares their experience with configuring the module for Python 3, while m-blanke mentions that they had previously worked on a PR for this feature but faced issues with multiple instances of the module. The conversation takes a turn when alandekok suggests creating two separate modules, rlm_python2 and rlm_python3, which leads to a debate about compatibility and backwards support. Arr2036 expresses concerns about duplicating code and suggests using a single module that can handle both Python 2 and 3. The discussion continues with users sharing their experiences and testing the module, ultimately leading to arr2036's conclusion that the module is functional for both Python 2 and 3. The conversation ends with robertpenz requesting integration of the changes into the 3.0.x branch due to the impending end-of-life for Python 2.7.""",0.05
378837238,"""The conversation begins with gajop seeking feedback on their code changes and expressing enthusiasm about resolving clang-tidy warnings. The tone is polite and collaborative, with gajop inviting discussion and thanking rtri for their review. However, rtri's brief response comes across as somewhat abrupt, which may indicate a slight shift in the tone of the conversation. Nevertheless, the overall tone remains professional and courteous.""",0.02
383803201,"""The conversation begins with Serophos reporting an issue and proposing a fix, which sets a collaborative tone. Alandekok responds by pushing a commit that addresses the issue, and their message is polite and helpful. Serophos expresses appreciation for alandekok's work and acknowledges their own limited programming expertise, maintaining a lighthearted and humble tone. The conversation remains civil and productive throughout, with both speakers focused on resolving the issue rather than engaging in conflict or criticism.""",0.00
386137186,"""The conversation begins with sanguinariojoe presenting a new collision detector model and ashdnazg responding with suggestions for improvement. The tone remains polite and collaborative, with both speakers agreeing on the need for caution and further testing. rtri joins the conversation, offering additional insights and ideas, which are met with appreciation by sanguinariojoe. However, as the discussion progresses, a slight sense of confusion arises due to branch management issues, leading to a brief moment of frustration from sanguinariojoe. Nevertheless, the overall tone remains civil and constructive, with all speakers working together to refine the model.""",0.05
