issue_id,summary,possibility_toxic
935043642,"""The conversation starts with dixius99 reporting a bug where DOSBox-X fails to launch on macOS Big Sur due to missing dylibs. joncampbell123 responds, questioning the report and suggesting that the necessary .dylib files should be present in the app bundle. The tone remains neutral until joncampbell123 mentions that the issue is a duplicate of another ticket, which prompts dixius99 to apologize for not seeing it earlier and offer to close the current conversation. The exchange ends on a collaborative note with dixius99 willing to share information on the other ticket.""",0.00
970346459,"""Contributor iBug proposes adding support for an `id` attribute to admonition blocks, providing examples and discussing potential implementation details. waylan responds with a counter-proposal to add support for attribute lists instead, citing compatibility issues with existing extensions. The conversation remains neutral and focused on the technical aspects of the proposal until waylan mentions closing the issue in favor of a new extension, which iBug does not respond to. The tone shifts slightly as waylan's responses become more authoritative, but the conversation remains civil and technically oriented throughout.""",0.12
977966256,"""Contributors discuss adding support to skip or ignore document headers in the table of contents. j1elo proposes an idea and provides example code, which sparks a neutral discussion with waylan questioning the use case. iBug suggests adopting a setup from Ruby Kramdown for compatibility, while j1elo clarifies the need for excluding specific headers. The conversation takes a turn when j-davis-2022 shares a personal project experience, highlighting the usefulness of such a feature and expressing enthusiasm. The discussion remains collaborative and focused on finding a solution.""",0.04
979989344,"""The conversation starts with brylie reporting an issue with WordPress Docker service failing to build due to a problem with xdebug installation. timnolte suggests trying a different Node/NPM version and deleting the node_modules directory, but brylie reports that the problem persists. tmdk investigates and finds that the issue is caused by the wordpress image already containing xdebug, leading to a conflict when trying to install it again. The conversation becomes slightly tense as brylie expresses frustration with the recurring issue and the time wasted on troubleshooting. The tone shifts from neutral to slightly frustrated and urgent, with brylie emphasizing the need for a fix. The conversation ends with tmdk providing more information about the cause of the issue and suggesting that it should be fixed by changing the Dockerfile to base the new build on the official wordpress docker image instead of its own previous build result.""",0.23
1239808896,"""The conversation starts with bwhmather proposing changes to uvicorn's server lifecycle management, which is met with interest from florimondmanca. However, as the discussion progresses, florimondmanca raises concerns about the proposed API and suggests alternative approaches, leading to a shift in tone towards a more collaborative and exploratory conversation. The discussion remains civil and focused on finding the best solution, with both participants sharing their use cases and experiences. The tone becomes slightly more cautious when discussing potential issues and limitations, but overall the conversation remains constructive and open-minded.""",0.05
1247089616,"""Several contributors discuss a pull request testing a new phpstan-dba feature. User staabm requests feedback on reported issues, and user stof provides input, suggesting that having indexes for everything might have drawbacks. The conversation remains neutral and focused on the topic, with users discussing potential false positives and ways to improve the feature. The tone shifts slightly when user Seldaek mentions that table size metrics seem useless without prod data, but overall the discussion remains constructive and collaborative.""",0.05
1862070893,"""Contributors discuss adding a filter option on Packagist to list packages compatible with specific version constraints. fe-hicking requests guidance, and Seldaek responds neutrally, explaining the complexity of the issue. The conversation remains constructive, with both parties exchanging ideas and potential solutions. However, when GuySartorelli points out a possible duplicate issue, the tone shifts slightly as fe-hicking's enthusiasm is tempered by the possibility that their request may not be novel. Despite this, the conversation ends on a collaborative note, with contributors exploring ways to implement the desired feature.""",0.06
12543441,"""The conversation begins with jmikola requesting jwage's review of a commit that reverts behavior originally added by jwage. The tone is neutral and collaborative, with tystr chiming in to agree with jmikola's assessment. However, when jmikola mentions the need for rebasing if another issue is merged first, the conversation takes on a slightly more formal tone, with jmikola providing additional technical details. The conversation ends on a positive note, with jwage expressing approval.""",0.05
93144364,"""Several users discuss an issue with qBittorrent's 'Last Seen Complete' feature, which appears to be updating incorrectly for incomplete torrents. yurivict initiates the conversation, expressing frustration and confusion over the issue. chrishirst responds neutrally, asking for more information and suggesting possible explanations. The conversation remains civil until maersi shares their own experience with the issue, describing a strange occurrence where 'Last Seen Complete' went backwards in time. Plantfood chimes in with a potential solution, but it's not directly related to the issue at hand. The conversation ends abruptly when ghost closes the ticket, citing that it was reported on an old version and is likely fixed in the latest version.""",0.21
93180288,"""Contributor FuturePilot reports an issue with the WebUI port forwarding, suggesting a rename and pointing out the lack of a checkbox to disable it. ngosang responds, explaining that the option is not available to prevent inexperienced users from losing access to the Web UI. The conversation remains neutral until FuturePilot expresses mild disagreement with ngosang's reasoning, but ultimately acknowledges their point. The tone remains collaborative throughout, with both contributors focused on finding a solution.""",0.04
118480369,"""The conversation starts with diazbastian requesting a feature to preview emojis in a larger size and suggesting the possibility of changing emoji packs. However, auchri responds by stating that they want the same emojis across all official clients, which slightly dampens the tone. The conversation remains neutral until telegramdesktop assures diazbastian that new emojis will be supported in the next version, after which auchri redirects the conversation to a related issue (#2804), and the conversation ends with github-actions[bot] locking the issue due to inactivity.""",0.03
118919271,"""The conversation starts with atsheehan describing an issue with the `rake db:structure:dump` command and proposing a fix. rishav responds neutrally, suggesting that atsheehan create a Pull Request. The tone remains collaborative until rails-bot marks the issue as stale due to inactivity, causing a slight tension shift. datashaman then enters the conversation with an observation about the usefulness of the dump date, which slightly diverts the discussion but maintains a neutral tone. Overall, the conversation remains civil and focused on resolving the technical issue.""",0.05
120669449,"""The conversation starts with doctrinebot describing a bug issue and providing detailed information about the problem. The tone is neutral and informative. As the conversation progresses, kozlice comments on the issue, expressing frustration and asking for an update. ocrimius responds, removing the ""feedback required"" flag and mentioning a related pull request. The tone remains neutral, but with a hint of defensiveness from ocrimius. Overall, the conversation is technical and focused on resolving the bug issue.""",0.04
120669455,"""The conversation starts with doctrinebot creating an issue on behalf of sinner, requesting a feature to filter table names for PostgreSQL Schemas. The tone remains neutral until doctrinebot closes the issue as duplicated and incomplete, which might be perceived as dismissive. However, there is no visible reaction or escalation from other participants, and the conversation ends without any notable tension.""",0.07
120671151,"""The conversation starts with doctrinebot posting an automated message about a pull request related to an existing Jira issue. The tone remains neutral until davidkmenta expresses frustration and requests resolution, followed by wwsh who also reports issues with the latest Doctrine version. The conversation is brief and focused on resolving the technical problem, without any notable tension or personal conflicts.""",0.05
162143997,"""The conversation starts with voxik suggesting a possible improvement to avoid dependency on pkg-config for precompiled versions of gem. flaviorjones responds by mentioning another issue related to licensing, which might lead to removal of the feature altogether. The tone remains neutral and informative until md5 joins in, providing additional context about the other issue. flaviorjones then assures that the problem will be fixed in a future version, ending the conversation on a slightly more positive note.""",0.08
224925160,"""The conversation begins with compwron reporting an issue with installing nvm, providing detailed information about their environment and steps taken. ljharb responds neutrally, asking for clarification on some points. The tone remains neutral until ljharb asks a question that implies compwron may have made an error, which leads to a slight defensiveness from compwron. However, the conversation remains collaborative, with ljharb offering helpful suggestions and compwron providing additional information. The issue is eventually resolved when compwron discovers an incorrect setting in their profile files, and they thank ljharb for the debugging help.""",0.08
227599044,"""User phil123456 reports an issue with nvm not working after installation, and receives guidance from ljharb. The conversation starts neutrally but becomes slightly tense as phil123456 expresses frustration over having to manually execute a command. ljharb clarifies the usage of nvm.sh and provides troubleshooting steps, which phil123456 follows. However, the issue persists, leading to further discussion about shell configuration files. The tone remains mostly neutral, with occasional hints of impatience from both users, but ultimately ends on a collaborative note as they explore possible solutions.""",0.23
239122479,"""Contributors discuss a bugfix pull request. Constantin07 submits the PR, and ansibot notifies relevant users. sergey-trukhin suggests it's a duplicate of another PR, which leads to a brief exchange with wimnat about related issues. s-hertel then chimes in, stating that the issue is already fixed, ending the conversation on a neutral note.""",0.07
257507626,"""The conversation starts with lol768 expressing willingness to take over building functionality after Caddy removed `buildworker` and `devportal` repositories. librecc shares cached versions of the removed repositories, which sparks a discussion about licensing and usage. mholt clarifies that the removed repositories were never licensed for external use and are now closed-source internal tools. The tone shifts as librecc expresses enthusiasm for the buildworker tool, but mholt reiterates that there are no plans to grant licenses for its use. lol768 accepts the situation and decides to work on a solution, ending the conversation on a collaborative note with extraymond expressing appreciation.""",0.14
267630078,"""The conversation starts with gsemet expressing a preference for using pipenv over requirements.txt and discussing an issue with dependencies not being installed when using pip install. vphilippon responds neutrally, suggesting that auto-generating requirements.txt is not necessary and offering a workaround. The conversation remains civil until techalchemy mentions a possible bug related to environment markers, which leads to a brief discussion about the details of the issue. erinxocon notes that python 2.6 is not officially supported, but this does not escalate the tone. gsemet provides more information about their setup and the issue they are experiencing, and vphilippon asks for clarification on some points. The conversation ends with a discussion about parsing Pipfile and the possibility of splitting the parsing part from the pipenv CLI into separate packages.""",0.04
267720560,"""Several contributors discuss the usage and benefits of Pipfile.lock. rwillmer initiates the conversation, expressing confusion about the file's purpose, and vphilippon provides a clear explanation. The tone remains neutral until asmaier mentions that rwillmer's documentation changes were removed, which might have caused minor frustration. uranusjr enters the conversation, providing additional clarification on how to install from the lock file, and the discussion ends with 55stella asking a related question, maintaining a collaborative atmosphere throughout.""",0.05
284822263,"""The conversation starts with RobLoach proposing a feature to scale the menu up to 200% and suggesting setting a minimum value to prevent it from disappearing. Inactive123 responds neutrally, disagreeing with the latter suggestion. Anyputer joins the conversation with a lighthearted comment about window opacity already causing RetroArch to disappear, adding a playful tone to the discussion.""",0.08
298006223,"""The conversation starts with Celmor describing an unresolved code issue and seeking guidance, which leads to a neutral discussion among multiple users about potential solutions. However, when behlendorf explains that backporting a specific fix is not feasible due to its destabilizing nature, the tone shifts slightly as samuelxhu expresses understanding but also concern for 0.7.X users. The conversation remains civil and focused on finding alternative solutions, with no significant escalation of tension or conflict.""",0.05
303501715,"""Several contributors discuss an unresolved issue with mongoose queries. alpmusti requests help with a code problem and lineus offers a solution that works, but notes a difference in behavior between mongoose versions 4 and 5. The conversation remains neutral and collaborative throughout, with other users chiming in to thank the helpers and confirm the solution.""",0.00
303526807,"""The conversation starts with codecalm introducing a Jekyll plugin and requesting it be listed on the plugins page. The tone is neutral and collaborative, with DirtyF responding helpfully and chrisfinazzo offering to submit a PR. However, when discussing the logistics of listing the plugin, the conversation becomes slightly more formal and procedural, with references to specific repos and READMEs. The tone remains polite and cooperative throughout, with participants working together to find a solution.""",0.05
303825095,"""The conversation starts with ljacomet providing guidance on configuration locking and dependency management. The tone remains neutral as melix provides feedback and suggestions for improvement, including test coverage and metadata handling. However, when ljacomet questions the need for an additional task, the conversation takes a slightly defensive turn, but melix responds calmly, acknowledging the alternative solution proposed by ljacomet. Overall, the conversation remains constructive and focused on improving the feature set.""",0.05
305429071,"""The conversation begins with ashmaroli summarizing changes to a code, which pathawks reviews and questions if it should be part of the 3.8.0 release. Ashmaroli clarifies that introducing class constants would not be suitable for a patch release, leading to a brief discussion on the release timing. The tone remains neutral and collaborative throughout, with pathawks apologizing for any confusion and ashmaroli providing clear explanations.""",0.00
316630309,"""Contributors discuss a code issue causing an error message in Dokuwiki. Turnermm reports the problem and kvnyang shares their experience with the same issue. Selfthinker suggests updating the include plugin, which has already been fixed. The conversation remains neutral until tmo26 expresses frustration over the update not showing up in the extension manager. Micgro42 intervenes, updates the plugin's version number, and resolves the issue, ending the conversation on a positive note.""",0.00
324615930,"""Contributors discuss enabling SSL verification by default. User jes proposes a solution and user kraih provides feedback, pointing out overlooked areas and potential issues with the change. The conversation remains neutral until kraih mentions that the patch breaks requests to HTTPS sites with valid certificates on certain operating systems, introducing tension. However, the tone shifts back to collaborative as jes thanks kraih for fixing the issue and they discuss testing and implementation details.""",0.12
327361942,"""The conversation starts with anparker's pull request to implement Mojo::IOLoop::Stream subclasses for HTTP and WebSocket connections. kraih reviews the code, suggests a change, and eventually calls for a formal vote on the pull request, expressing his approval of the new stream APIs. However, after applying the changes, kraih reverts them due to unforeseen issues, leading to a neutral conclusion.""",0.07
329086591,"""User LilSebastian5000 reports an issue with Gatling's user ramp-up graph, claiming it shows inaccurate results. They provide a script and examples to demonstrate the problem. Contributor slandelle responds, clarifying that the statistics chart displays requests, not users, and explains how the active users graph is computed. The conversation remains neutral until LilSebastian5000 expresses frustration at the graph's behavior, wondering why it doesn't show 5 users being ramped up at once unless the script is halted early. Slandelle provides a technical explanation for this phenomenon, but the conversation ends with no clear resolution to the issue.""",0.27
337370653,"""The conversation begins with WestLangley providing an update on the code, specifically mentioning environment mapping and reordering chunks. They also ping sunag to bring their attention to the changes. The tone remains neutral and collaborative throughout, with mrdoob responding with a simple thank you note, indicating appreciation for the update.""",0.00
337557052,"""The conversation begins with donmccurdy fixing an issue (#14256) and seeking feedback from takahirox. The tone is polite and collaborative. However, when mrdoob enters the conversation, they apologize for an unspecified mistake, and donmccurdy thanks them, maintaining a positive and appreciative tone throughout.""",0.05
352175657,"""The conversation begins with cbothner explaining a PR that translates service-specific missing object exceptions into one generic error, improving the development experience. georgeclaghorn provides feedback on commit squashing and changelog entries. The discussion remains neutral until cbothner asks about handling errors raised in `RepresentationsController` for developer experience, to which georgeclaghorn responds with a technical explanation of why it's not immediately solvable. The conversation ends with georgeclaghorn deciding to merge the PR while considering the issue further.""",0.01
352177721,"""The conversation starts neutrally with cbothner suggesting improvements to error handling in the Azure gem, followed by a welcoming response from rails-bot. However, the tone shifts when georgeclaghorn requests a rebase and later reverts the changes due to test failures. cbothner apologizes for the oversight and explains their testing process, leading to a discussion on the inconsistencies of error types from Azure. The conversation remains collaborative, with cbothner offering alternative solutions and georgeclaghorn providing guidance on how to proceed.""",0.04
355578053,"""The conversation starts with Redsandro describing an issue with ZFS and Linux versions, seeking guidance on how to resolve it without manual recompilation after every kernel update. rincebrain responds neutrally, suggesting that the packaging hasn't been updated in 3 years and that the instructions might be incomplete. Redsandro provides more information and eventually finds a solution, but expresses frustration with the unclear documentation. The conversation remains civil, with Redsandro thanking rincebrain for their input and providing detailed steps on how to build and install ZFS+DKMS. The tone shifts slightly when Redsandro asks why they need to modprobe and enable services manually, wondering if there are build switches to simplify the process. The conversation ends with a suggestion to revamp the documentation, particularly for the compilation/installation part.""",0.08
363298070,"""The conversation starts neutrally with GregorKopka submitting a pull request for compatibility with python 3. behlendorf responds by mentioning the need to reconcile the work with another contributor's issue, #7828. codecov[bot] provides a report on the code coverage. The tone remains neutral and technical throughout the conversation, with no signs of tension or conflict. GregorKopka eventually closes the pull request after realizing the overlap with the other issue.""",0.00
367593997,"""The conversation starts with HankG proposing a feature to allow copying and pasting images from the clipboard into the composition area, which is met with interest by Flaburgan. The discussion remains neutral and collaborative as they work through the implementation details, including drag and drop functionality. However, when HankG mentions an inconsistency between mobile and desktop calls, the tone shifts slightly as he expresses mild frustration at the discrepancy. Despite this, the conversation remains constructive, with Siedlerchr chiming in to suggest additional features. The discussion ends on a positive note, with HankG sharing a PR that addresses the original request and incorporates Flaburgan's suggestions.""",0.05
376883482,"""The conversation starts with herwinw proposing a patch to backport driver-specific escape modules for SQL from master to v3.0.x, which may break backwards compatibility. alandekok suggests merging the patch but notes that it should be selectively enabled to avoid changing existing behavior. The discussion remains neutral and focused on technical aspects until arr2036 expresses concern about breaking installs that consume data from the MySQL database. herwinw addresses this by adding a config option, and the conversation concludes with arr2036 reviewing and approving the changes.""",0.04
378837238,"""The conversation begins with gajop's neutral tone, seeking feedback on unresolved issues and expressing appreciation for the review. The tone remains collaborative as gajop offers explanations for some fixes and invites discussion. However, the conversation takes a brief turn when rtri responds curtly, which might be perceived as slightly dismissive or unhelpful, but ultimately does not escalate into tension.""",0.05
386137186,"""The conversation starts neutrally with sanguinariojoe introducing a collision detector based on Separable Axes Theorem (SAT) and ashdnazg providing feedback. However, when rtri suggests that the SA test should not be enabled unless necessary, the tone shifts slightly as sanguinariojoe apologizes for a mistake with the branches. Despite this minor setback, the conversation remains collaborative and focused on improving the code, with participants offering suggestions and ideas for optimization and improvement.""",0.05
435381203,"""Several contributors discuss implementing a 'Most Played' tab, with some expressing concerns about added clutter. The conversation remains civil, with participants sharing ideas and addressing potential issues. Ryunam suggests alternatives, such as sorting methods and optional toggles, but jdgleaver argues that a separate 'most played' playlist is more practical. The tone shifts slightly when jdgleaver mentions performance issues, but the discussion remains constructive. Ryunam contributes a bounty to reignite interest in the feature request, and the conversation ends with a summary of necessary points for implementation.""",0.03
435425415,"""Contributors discuss an unresolved issue with keyboard shortcuts on Turkish layouts. The conversation starts neutrally, with dogancelik explaining the problem and providing images to illustrate the issue. lampholder suggests a possible solution, which dogancelik confirms would work. However, aaronraimist reveals that a previous pull request probably broke the functionality, leading to a discussion about Electron's limitations. The tone remains collaborative, with contributors working together to find a solution. aaronraimist puts back a default menu item, and dogancelik tests it, finding that it still doesn't work on Turkish layouts. The conversation ends with dogancelik suggesting a possible fix from an Electron issue thread, which aaronraimist agrees to consider.""",0.00
