issue_id,summary,possibility_toxic
544658428,"""The conversation starts with amtriathlon discussing plans to implement sport-specific zones in GoldenCheetah. srwareham echoes a request for rowing pace zones and shares a CSV file of rowing data, which liversedge agrees to consider supporting. The discussion remains neutral until Mickyduck55 joins, sharing their experience with ErgData and offering to supply files for import. amtriathlon responds helpfully, guiding Mickyduck55 on how to share the files and troubleshoots minor issues with importing the data. The conversation ends on a collaborative note, with users working together to improve GoldenCheetah's support for rowing data.""",0.00
545354521,"""The conversation starts with ericchristoffersen introducing a change that improves the mergefile behavior and refines training mode behavior. However, he soon expresses concerns about the sensitivity of the change to having good GPS points and proposes writing a parameterized GPS route smoothing filter. amtriathlon responds neutrally, tagging the issue for 3.6 but delaying the merge until it's ready. The conversation then shifts as ericchristoffersen explains the root cause of slope fluctuations in GPS data and introduces an update to the cubic interpolator to fix the issue. After a few more commits, ericchristoffersen finally declares the change good to go, ending the conversation on a positive note.""",0.00
556060860,"""The conversation begins with mdaftab88 reporting a bug and providing steps to reproduce it. eileencodes is able to reproduce the issue and acknowledges its severity. The tone remains neutral and collaborative throughout, with eileencodes working on a fix and eventually submitting a PR. mdaftab88 confirms that the fix resolves the issue, and the conversation ends on a positive note with alexander-alyoshin inquiring about the release timeline for the changes.""",0.00
556204963,"""undefined method 'get_schema_cache' for nil:NilClass (NoMethodError) due to incompatibility with gem activerecord-tableless, resolved by removing the gem and including its functionality in the model.""",0.00
556417710,"""The conversation starts with travisp reporting an issue with ActiveStorage and UUIDs, describing the steps to reproduce the error and the expected behavior. ryenski suggests that the issue is related to a previous bug report and provides a test script to reproduce the error. jeremy asks if anyone is motivated to work on a PR to expand support for non-integer PKs. The conversation then shifts to a discussion about the underlying cause of the issue, with gmcgibbon providing historical context and suggesting that the problem is rooted in an earlier issue. ryenski proposes a possible solution, but gmcgibbon expresses concerns about the complexity of the code and the potential for unforeseen consequences. The conversation ends with josh-m-sharpe reporting that they encountered the same issue while trying out new proxy helpers for ActiveStorage.""",0.07
561117822,"""The conversation starts with ghost reporting an issue with gpSP not working on Lakka on Raspberry Pi Zero, despite following instructions to place the bios file in the system folder. Ghost expresses frustration and mentions that mGBA works but is laggy. The tone remains neutral until ghost finds a solution by replacing the gpsp_libretro.so file, which they claim was broken in Lakka 2.3.2 on Raspberry Pi Zero. Bailey293 then responds, seeking clarification on what file ghost replaced it with, as they are experiencing the same issue.""",0.00
562432173,"""The conversation begins with ghost making a contribution to add a trailing newline to the lock file and seeking guidance on how to test it. MikeMcQuaid responds positively, thanking ghost for their first contribution. The tone remains friendly and appreciative until ghost asks about releases for external commands like `bundler`. MikeMcQuaid's response, stating that there are no releases and users should always update to the latest version/master, is brief but not unfriendly, ending the conversation on a neutral note.""",0.02
563353855,"""The conversation starts with jdgleaver's introduction of a PR for DPI-based scaling in the Ozone menu driver. inactive123 responds positively, confirming that the feature works well even at high resolutions. natinusala joins the conversation, sharing a poll from Switch users regarding the current ozone scale, which sparks a lighthearted and humorous exchange between jdgleaver and natinusala. The tone remains collaborative and friendly throughout the conversation.""",0.00
592108544,"""Contributors discuss an unresolved UI issue with the editor pane. Sharma-Hrishabh provides a fix, which t-paul reviews and suggests improvements. MichaelAtOz intervenes to guide the process of claiming a bounty for resolving the issue. The conversation remains neutral until t-paul points out a flaw in Sharma-Hrishabh's approach, leading to a mild defense from Sharma-Hrishabh. However, the tone shifts as t-paul and Sharma-Hrishabh engage in a collaborative problem-solving discussion, exchanging ideas and code snippets to address the issue. The conversation ends on a constructive note with a plan for further improvement.""",0.07
593788893,"""Prinzhorn initiates a discussion about an issue with `source_address` being set to an odd value, suggesting it should be `None` until known. Prinzhorn also questions the purpose of additional values in IPv6 addresses and proposes renaming some variables for consistency. mhils responds, mentioning that they have already fixed the `source_address` issue on a different branch and agrees with the variable rename suggestion. The conversation remains neutral and collaborative throughout, with both participants engaging in a respectful and informative discussion.""",0.00
619483018,"""The conversation begins with derrabus submitting a pull request to fix a regression issue. noniagriconomie responds with a suggestion for creating a test to ensure event priorities don't change, expressing caution about altering priorities. derrabus reassures that the change is safe and agrees that an integration test would be beneficial. The conversation remains neutral and collaborative throughout, with fabpot thanking derrabus at the end.""",0.00
619493887,"""The conversation starts with azhurb posting a bug fix for an issue related to custom `Content-Type` headers. ro0NL responds positively and asks about their patch suggestion, which sparks a discussion on whether to preserve content-type in all cases or only when the raw body data is not empty. The tone remains neutral and collaborative throughout, with azhurb providing additional context from a previous discussion in 2016. fabpot thanks azhurb for the fix, ending the conversation on a positive note.""",0.00
619505946,"""The conversation starts with reanim8ed reporting an issue with event listeners in Symfony 4.4.5, which derrabus quickly responds to as not a bug but expected behavior. Reanim8ed references a Symfony blog post that seems misleading, and derrabus acknowledges the mistake. The conversation then shifts to clarifying the correct behavior of event listeners, with javiereguiluz and wouterj providing additional context from the documentation. Wouterj explains the different scenarios for defining event listeners and provides a summary table to clarify the expected behavior. The tone remains neutral and informative throughout, with no personal attacks or tension.""",0.00
624330459,"""The conversation begins with munierujp's neutral request to rename 'lolex' to 'FakeTimers'. The tone remains calm and collaborative throughout, with staleb[bot] automatically marking the issue as stale due to inactivity. Munierujp politely requests a review, and mroderick responds positively, thanking them for their contribution and providing context on the publishing process, ending the conversation on a friendly note.""",0.00
626316926,"""The conversation begins with a polite request from duduke for adding Hebrew as a translation language, which is promptly handled by guoyunhe. WeedyWeedSmoker facilitates the interaction and confirms the resolution, leading to a positive and efficient conclusion.""",0.00
627989539,"""The conversation starts with jbrockmendel explaining a proposed change to PeriodDtype, which is met with neutral feedback from others. As the discussion progresses, jorisvandenbossche suggests an alternative name, and the tone remains collaborative. However, when jbrockmendel mentions plans to mix the new PeriodDtype into the core.dtypes, the conversation becomes slightly more formal, but still constructive. The discussion ends on a positive note with jbrockmendel expressing confidence in the proposed changes.""",0.04
630474484,"""The conversation begins with Smittytron providing context and updates for an Aftermath mission. The tone remains neutral until abcdefg30 merges the changes, referencing Orb370's feedback. The conversation is collaborative and focused on improving the game, with participants working together to address issues and incorporate feedback.""",0.00
631493258,"""Contributor ljian3377 reports an issue with stubbing a readonly property using sinon. They provide examples of their attempts to reproduce and work around the problem. Maintainer mroderick responds by stating that allowing stubbing non-existent properties would lead to confusing scenarios, but contributor gukoff questions this decision and suggests adding functionality behind a flag. fatso83 explains the reasoning behind not allowing stubbing non-existent properties and mentions an alternative API that could be used instead. The conversation remains neutral until gukoff offers a potential solution in the form of a pull request, which is met with a positive response from fatso83.""",0.04
637387491,"""The conversation starts with Trott's neutral pull request for linting code fence language/grammar strings, followed by a checklist and certification of origin. The tone remains collaborative as Trott acknowledges DerekNonGeneric's work and expresses appreciation. However, when discussing a potential issue with a 'shell' code fence flag, the tone shifts to mild concern and caution. DerekNonGeneric expresses relief that the issue was addressed, but also mentions a fear about potential problems. The conversation ends on a positive note with MylesBorins adding a label and manually skipping a landing, maintaining a neutral and collaborative tone throughout.""",0.05
637469461,"""The conversation starts with ghost submitting a pull request to fix an issue on FreeBSD. Adamdmoss reviews the code and suggests moving the zero'ing up into the freebsd spl's mutex_init(). Ghost agrees, and codecov[bot] provides a report on the coverage of the changes. The tone remains neutral and technical throughout the conversation, with contributors discussing the details of the fix and how to implement it. There are no signs of tension or conflict.""",0.00
637472836,"""masx200 reports an issue with Node.js's HTTP client not supporting keep-alive feature, providing a detailed code snippet to reproduce the bug. The conversation remains neutral and focused on solving the technical problem until DerekNonGeneric provides a potential solution from an external source. Flarna offers additional insight into consuming response data on the client side, which is acknowledged by masx200 as the correct answer. The conversation ends with bnoordhuis closing the issue as answered.""",0.00
638853262,"""The conversation starts with GuillaumeGomez questioning a change in the sidebar ordering. kinnison responds neutrally, explaining their reasoning behind keeping the sidebar ordering in sync with the main content. The tone remains calm and technical until bors approves the commit without issue. RalfJung then enters the conversation, asking bors to mark small PRs for rollup, and kinnison agrees to remember this for future reference. The conversation ends on a collaborative note.""",0.00
638866639,"""The conversation begins with a neutral tone as tesuji requests review and Amanieu approves the commit. The discussion remains calm until RalfJung suggests rolling up, which does not seem to trigger any tension or conflict. Overall, the conversation is brief and professional, without any notable shifts in tone or sentiment.""",0.00
642604919,"""The conversation begins with bslenul reporting a bug where binding left or right analog to keyboard keys doesn't work. They provide detailed steps to reproduce the issue and test results on different environments. inactive123 joins the conversation, offering a potential solution by sharing a commit link. The tone remains neutral and collaborative throughout, with bslenul expressing gratitude for the fix after testing it successfully.""",0.00
642902435,"""Several users discuss a persistent issue with RetroArch where pressing the Guide button causes the program to start a server, leading to significant slowdowns. The conversation begins neutrally, with Immersion95 sharing their experience and bslenul confirming the issue. corgana shares their own long-standing problem with the issue, which they had previously been told was caused by Steam, not Retroarch. As the discussion continues, users share similar experiences with different setups, and hizzlekizzle links to a related GitHub issue. The conversation remains collaborative and focused on finding a solution, with no notable tone shifts or personal conflicts.""",0.00
642933508,"""User XKCorp reports an issue with lost saves and states after updating RetroArch, expressing frustration. User bslenul responds helpfully, suggesting a possible solution, and user cmitu joins in, providing additional context about changes to default save paths in version 1.8.9. The conversation remains neutral and informative until XKCorp thanks the users for their assistance, resolving the issue.""",0.00
643211766,"""Contributors discuss icon changes for a project. fpscan shares an initial design and jdgleaver thanks them but expresses concern over the change to the RACE icon, feeling the old one was more appropriate. fpscan explains their reasoning and offers to revert the change. The conversation remains neutral and collaborative, with jdgleaver suggesting that if logos are used, they should be changed consistently across all icons. They agree to use the old RACE icon for now and consider gathering feedback through a Twitter poll in the future.""",0.04
651892225,"""The conversation starts with IgorMinar explaining the motivation behind decreasing the minBodyLength limit for commit messages in the angular/angular repo. He provides evidence of friction points caused by the current high limit and suggests a new lower limit of 20 chars, citing examples of minimalistic and valid commit messages. The tone remains neutral and collaborative throughout the conversation, with other contributors such as sonukapoor and gkalpak offering support and assistance. However, the conversation ends abruptly when the angular-automatic-lock-bot locks the issue due to inactivity, without any significant tension or conflict arising.""",0.00
651917272,"""KingMario submits a PR to update the documentation for Angular pipes, aiming to make the description more generalized. The conversation remains neutral and collaborative throughout, with KingMario providing context and justifying the change with personal experience. AndrewKushnir eventually merges the PR, thanking KingMario for their contribution, and the conversation ends on a positive note.""",0.00
651934683,"""The conversation starts with IgorMinar providing information and seeking clarification from gkalpak. Gkalpak initially reports an issue but then resolves it, apologizing for the unnecessary notification. The tone remains neutral and collaborative throughout, with IgorMinar making updates and thanking aikidave for their contributions. The conversation ends with a bot automatically locking the issue due to inactivity, without any escalation or tension.""",0.00
670181111,"""The conversation begins with Mark-Simulacrum bumping the release number and requesting a review from @ghost. The tone remains neutral as bors approves the commit and testing commences. The conversation ends on a positive note with the test being successful and the changes being pushed to stable, all without any tension or conflict.""",0.00
670198245,"""Several contributors discuss implementing `Index` and `IndexMut` for arrays. User pubfnbar adds implementations, and rust-highfive welcomes them to the project. scottmcm points out errors in the pull request, which pubfnbar addresses. The conversation remains civil and focused on the technical topic at hand.""",0.00
670237997,"""The conversation starts with nikomatsakis creating a tracking issue for the RFC 'C-unwind ABI'. cratelyn expresses interest in helping implement the feature. The discussion is mostly technical and focused on the implementation details of the RFC, with participants discussing various aspects such as ABI strings, unwind behavior, and codegen tests. There are some concerns raised about the potential impact on existing codebases and the need for a transition period before making changes to the existing ABIs. The conversation ends with joshtriplett proposing to merge the stabilization request, which is then reviewed by other team members.""",0.00
670244317,"""The conversation begins with JulianKnodt submitting a PR to fix a bug, accompanied by a lighthearted comment. rust-highfive responds warmly, welcoming JulianKnodt and providing guidance on the review process. The tone remains positive and collaborative throughout, with lcnr expressing gratitude and bors confirming approval of the commit. The conversation is characterized by a supportive and appreciative atmosphere, with no signs of tension or conflict.""",0.00
702773820,"""Contributors discuss a code issue with marker pointers. Jejones3141 explains the reasoning behind their changes, but arr2036 finds the code hard to understand due to the order of functions. Jejones3141 agrees to change it and later confirms that they have made the adjustment. The conversation remains neutral and collaborative throughout, with participants working together to resolve the issue.""",0.00
708153303,"""The conversation begins with nickvergessen identifying a TypeError issue and providing a clear explanation of the problem. The tone is neutral and technical, with nickvergessen offering a solution. rullzer enters the conversation, agreeing with the fix and suggesting backports to stable20 and stable19. The conversation remains calm and focused on resolving the issue, with no signs of tension or conflict.""",0.00
717290138,"""The conversation starts with gk-fschubert reporting an issue with building the FreeRADIUS server and receiving an error message about linking to the 'rlm_python' module. alandekok responds, pointing out that the `--with-rlm_python=yes` option is incorrect for Python 3 and suggests using the `rlm_python3` module instead. gk-fschubert tries this but reports the same issue, leading alandekok to suggest trying a different branch from GitHub. The conversation remains technical and focused on resolving the issue, with no apparent tension or conflict between the participants.""",0.02
718882247,"""The conversation starts with beberlei explaining an ORM issue and its implications on database compatibility. morozov suggests using the portability layer to address the problem, which is met with questions from greg0ire about implementation details. As the discussion progresses, morozov clarifies his suggestion, leading to a collaborative exchange of information. The tone remains neutral and technical throughout, with participants working together to find a solution. The conversation ends on a constructive note, with beberlei referencing a related issue and github-actions[bot] locking the thread due to inactivity.""",0.01
719467028,"""The conversation begins with terryburton introducing a new dhcp_sql instance of rlm_sql, explaining its features and differences from RADIUS. The tone is informative and neutral. alandekok then asks if anyone has objections to merging the changes, which prompts arr2036 to respond briefly but positively. Throughout the conversation, participants maintain a professional and respectful tone, with no signs of tension or conflict.""",0.00
719712881,"""The conversation starts with mvorisek proposing a code improvement and greg0ire responding with a request to squash commits together. After mvorisek complies, greg0ire thanks him and mentions an issue with Codecov's behavior. thomasrockhu is tagged in and suggests opening a ticket, but greg0ire notes that the issue seems to have resolved itself, making it difficult to investigate further.""",0.04
723112329,"""The conversation begins with deivid-rodriguez submitting a pull request, which is met with appreciation from ngan. The tone remains positive and collaborative throughout the conversation, with participants exchanging information and expressing gratitude. There are no triggers of tension or conflict, and the social orientation is characterized by warmth and agreeableness. The sentiments expressed are polite and courteous, with contributors showing enthusiasm and friendliness. The conversation ends on a pleasant note, with deivid-rodriguez providing clarification on the release version.""",0.01
739501498,"""The conversation starts with a neutral tone as contributors discuss an unresolved code issue. arr2036 mentions the need to move the decoder to dbuffs and references a previous meeting's resolution to leave the PR open until large file transfers are figured out. alandekok suggests separating the PR based on another issue, which jpereira agrees to do after merging a related pull request. The conversation remains collaborative and focused on finding solutions, with no significant tone shifts or personal conflicts.""",0.00
740634999,"""The conversation starts with ybenhssaien reporting a bug in Symfony, providing detailed steps to reproduce and a possible solution. The tone is neutral and informative. Carsonbot responds with a friendly ping, asking if the bug is still relevant and if a workaround has been found. Ybenhssaien replies, mentioning that the pull request is still open and they will investigate what's going wrong. The conversation remains polite and collaborative throughout.""",0.00
767087029,"""The conversation starts with memeplex reporting an issue with passing arguments to `%%cython` and providing examples of their attempts to resolve it. They express mild frustration but remain neutral in tone. As they debug the issue, they discover that the problem is caused by the lexer getting confused by the `=` character before the quotes. Memeplex questions the default behavior of setting `posix = False` and suggests that `posix = True` would be preferable. MrMino joins the conversation, acknowledges the issue as a bug, and expresses willingness to help resolve it. The tone remains collaborative and focused on solving the problem throughout the conversation.""",0.00
770039478,"""The conversation begins with skalaydzhiyski introducing a new feature and explaining its usage through examples. The tone is informative and neutral. MrMino enters the conversation, questioning whether the PR is a duplicate of another issue, which leads to a brief exchange between skalaydzhiyski and MrMino. The conversation remains polite and focused on the topic at hand. Carreau joins in, apologizing for the delay in reviewing and expressing appreciation for the work done. The tone remains positive and collaborative throughout.""",0.00
772226105,"""User GasinAn reports an issue with IPython and shares error messages they encountered. They express frustration but mention that they can still continue using IPython despite the errors. User MrMino responds by asking if the issue is still present and suggests trying an updated IPython version, mentioning a similar experience on Windows. After some discussion, GasinAn reports that everything is now working well, and MrMino marks the conversation as a duplicate of another issue. The conversation ends with a positive note, but also with some uncertainty about when the fix happened.""",0.08
785550073,"""The conversation starts with vdonato reporting a bug and providing a code sample. jreback responds by clarifying the issue and providing additional context. The tone remains neutral until mroeschke agrees with jbrockmendel's assessment that the behavior is deprecated and will be corrected in a future version, leading to a calm conclusion.""",0.00
805964034,"""Contributors discuss a bug issue with RStudio. mirh reports the problem and provides detailed steps to reproduce it, expressing frustration over the program's unresponsiveness. kevinushey responds neutrally, filing an associated issue in the rmarkdown package and suggesting that the fix lies there. mirh thanks kevinushey for their report but questions whether 'waiting for input' is a valid reason for the program to become unresponsive. yihui enters the conversation, announcing that the issue has been fixed in the development version of rmarkdown, which brings the conversation to a positive close.""",0.05
806517131,"""Contributors discuss an unresolved RStudio issue where clicking on 'File' -> 'New Project...' or opening 'Tools' -> 'Global Options...' does nothing. User1 provides detailed steps to reproduce the problem and describes the expected behavior. User2 thanks User1 for raising the issue and promises to review it as part of ongoing development. User3 attempts to reproduce the issue but is unsuccessful, asking if there's anything unique about User1's machine configuration. The conversation remains neutral until a bot marks the issue as stale due to inactivity, eventually closing it.""",0.05
