issue_id,summary,possibility_toxic
965558043,"""The conversation starts with ell1e reporting an issue with python markdown and providing examples of expected and actual output. facelessuser responds by referencing the documentation and explaining that this is a known behavior. ell1e requests consideration for changing this behavior, citing user friendliness and consistency with other markdown libraries. The maintainer, waylan, enters the conversation and reiterates that there are no plans to change this behavior, as it follows the original rules of markdown. The tone shifts when ell1e expresses frustration and facelessuser mentions that python markdown is in the minority on this issue. alkisg joins the conversation, sharing a similar experience and asking for clarification on using bulleted lists with 2 spaces indentation. waylan provides guidance on structuring complex nesting in markdown, and the conversation ends with alkisg expressing understanding and ell1e suggesting potential improvements to markdown specifications.""",0.22
1094797666,"""The conversation starts with stevenxu-db reporting an issue with Yarn PnP and chalk 5, providing a detailed error message and repro steps. sindresorhus suggests that the problem lies with Yarn PnP and should be reported on the Yarn issue tracker. Kurt-von-Laven offers a workaround by adding a section to `.yarnrc.yml`. dobesv provides additional repro steps, which Qix- acknowledges as an known issue due to `yarn` lacking proper support for their package.json structure, but dismisses the conversation as unactionable and directs supporters to voice their concerns on the Yarn repository.""",0.23
1107934880,"""The conversation starts with mlocati reporting an issue with MultiTableDeleteExecutor failing due to a collation mismatch error. They propose adding a test to detect the issue and then updating the PR to fix it. However, tests are failing on their local machine but passing in GitHub Actions, leading to confusion and frustration. The tone shifts from neutral to frustrated as mlocati tries to understand why the tests are behaving differently in different environments. beberlei briefly joins the conversation to point out a missing commit, but the main focus remains on resolving the test issue.""",0.23
1124928026,"""The conversation starts with justlevine reporting a bug where WPCS logs a warning when `posts_per_page` is set to a function, despite expecting no error. dingo-d responds neutrally, explaining that PHPCS isn't aware of the context and can't know if the values would fall in the 'acceptable' category. The conversation remains technical until justlevine expresses mild frustration, feeling that the sniff should be ignored when `posts_per_page` is explicitly set. dingo-d offers a solution to silence the sniff, but justlevine insists it's a false positive. The tone shifts slightly as jrfnl joins in, confirming they can reproduce the issue and promising a fix in WPCS 3.0.0, while also explaining why dingo-d couldn't reproduce the issue due to differences in PHP versions.""",0.14
1130620450,"""Contributors discuss a code cleanup pull request. Stavros-k explains the changes and their purpose, while Ornias1993 questions the reasoning behind deleting certain lines of code. The conversation remains neutral until Ornias1993's tone shifts to mild frustration with a sarcastic comment. Stavros-k responds calmly, clarifying the changes. However, truecharts-admin intervenes, locking the pull request due to necro-posting concerns, ending the conversation abruptly.""",0.42
1225627893,"""Contributors discuss an unresolved code issue. chuckcarne requests guidance, and bslisowski offers a solution that doesn't work for chuckcarne, leading to mild frustration. ghost enters the conversation neutrally, offering additional troubleshooting steps. rudrakshkarpe suggests creating a virtual environment as a potential solution, which is met with skepticism by chuckcarne. However, chuckcarne eventually finds an alternative solution and reports success, ending the conversation on a positive note.""",0.13
1289611953,"""Contributors discuss an undefined behavior warning in security-related code. devnexen and Girgias are hesitant to touch the code, citing its basis on glibc implementation. cmb69 enters the conversation, expressing concern about suppressing warnings and suggests a fix by casting to `uintptr_t`. devnexen agrees to try the suggestion but later reports failure. The tone shifts as cmb69 questions devnexen's reversion of a previous fix, leading to a clarification that a new pull request has been submitted for the master branch.""",0.42
1529332213,"""A user reports an error installing gems with Bundler and provides detailed output. A maintainer responds neutrally, asking if the issue is related to a specific commit or GitHub package source. The conversation remains technical and collaborative until another contributor joins, mentioning that GitHub Packages are migrating to a new API and suggesting the user subscribe to a relevant discussion thread. The tone shifts slightly as the original poster thanks the maintainers for checking on the issue and notes that others are experiencing similar problems.""",0.05
1665316056,"""The conversation starts with eisberg reporting an error after upgrading to Doctrine version 2.9 and dmaicher suggesting a possible solution by reverting back to version 2.8.3 of DoctrineBundle. The discussion escalates as ostrolucky explains that the issue is caused by enabling strict XSD validation by default in DoctrineBundle 2.9.0, which breaks compatibility with gedmo extension. Several contributors, including alexander-schranz and jakubtobiasz, report similar issues and express frustration with the lack of a solution. The conversation becomes tense as ostrolucky suggests that gedmo should define its own XML schema, while stof argues that this would require significant changes to the way gedmo is configured. The discussion continues with various proposed solutions, including disabling XSD validation, introducing a new configuration setting, and releasing a patch to revert the change. Ultimately, dmaicher proposes reverting the change with a patch release, which seems to be the most likely solution.""",0.42
2044991685,"""The conversation starts with Qaz-7's proposal for unlocking Telegram Premium features, which is met with skepticism by wolf-yuan-6115. reisxd explains that premium features are server-sided, but Qaz-7 insists on finding a client-side solution. oSumAtrIX intervenes to close the issue due to its infeasibility, leading to a brief exchange between Qaz-7 and oSumAtrIX about modifying the app. The conversation ends with Qaz-7's insistence that modification is necessary, but oSumAtrIX confirms that it works without modification.""",0.23
355735509,"""The conversation starts with a neutral tone as behlendorf submits a pull request to investigate ARC collapse and richardelling tests it on a representative workload, providing results that show improvement. The discussion remains technical and collaborative until codecov[bot] reports an increase in coverage by 0.2%. However, the tone shifts when behlendorf closes the issue, stating that it doesn't address the root cause and additional investigation is needed, which may be perceived as slightly abrupt.""",0.23
436070932,"""Contributors discuss issues with the password reset process. richvdh shares their frustrating experience and receives a sympathetic response from lampholder, who suggests replacing the mechanics entirely. The conversation remains neutral until Palid intervenes to close the issue as a duplicate, ending the discussion on a somewhat abrupt note.""",0.07
555723232,"""Blackjacx initiates a discussion about Homebrew's behavior with upgrades, comparing it to other package managers. MikeMcQuaid responds neutrally, stating that `--no-upgrade` is not a supported flag. Blackjacx provides evidence from the help documentation, but MikeMcQuaid clarifies the behavior and apologizes for outdated information. The conversation remains technical until Blackjacx expresses frustration with Homebrew's limitations in managing dependencies across different Git branches. MikeMcQuaid responds by highlighting the differences between Homebrew and other dependency managers, leading to a slightly tense conclusion.""",0.17
1300321709,"""Contributors discuss an unresolved error issue with a Reddit video maker bot. User ass-warrior reports the error and shares the traceback, prompting William9923 to request the POST_ID value for troubleshooting. Anthony-Lloyd clarifies the purpose of the POST_ID, but ass-warrior reveals they left it blank as per instructions. The conversation remains neutral until JasonLovesDoggo suggests using version 2.3, which might resolve the issue.""",0.17
453085440,"""The conversation starts with joshm1204 seeking feedback on benchmark results comparing Pagy, Kaminari, and Will_paginate. yuki24 responds neutrally, providing context and analysis of the benchmarks, concluding that replacing Kaminari would not significantly impact app performance. oicitrapdraz counters with a differing opinion, emphasizing the importance of optimizing gem performance. The conversation remains civil but ends abruptly when yuki24 closes the issue, stating awareness of Kaminari's performance characteristics and ongoing efforts to improve it.""",0.14
793722661,"""The conversation starts with plfort sharing an old issue and suggesting a code optimization. beberlei reviews the patch positively but raises concerns about its impact on composite keys. The discussion remains technical and collaborative until beberlei expresses hesitation to merge the PR due to potential risks, which leads to a slight tone shift towards caution. However, the conversation remains constructive, with plfort addressing the concerns and rebasing the PR as requested. The tone shifts again when rvanlaak joins in, providing a neutral update on the status of the related issue.""",0.03
1198030494,"""The conversation starts with lukaszpolowczyk reporting a bug in the SvelteKit documentation where the NEXT button malfunctions. Mlocik97 and bluwy are unable to reproduce the issue, leading to mild frustration from lukaszpolowczyk. Rich-Harris suggests looking at the code to determine the cause of the error. The conversation takes a turn when lukaszpolowczyk discovers that a browser extension is causing the issue, leading to embarrassment and apologies. Mlocik97 points out that it's impossible to fix the website for all possible browser extensions, and the correct solution is for the user to disable the extension on specific websites. The conversation ends with bluwy closing the issue, but then reopening it after dummdidumm highlights that the built-in translator in Chrome also causes a similar error.""",0.42
1269755152,"""User MR-EHAB11 opens an issue with a template but fails to provide a description, prompting 0xdavidel to comment that it's a dummy issue and can be deleted. MR-EHAB11 responds defensively, asking why they should delete it, and 0xdavidel clarifies that the issue lacks content. The conversation ends with a tone of mild frustration and confusion.""",0.23
242927260,"""The conversation starts with cclauss reporting an issue with flake8 tests on Python 3. ThiefMaster suggests excluding the file from tests, but cclauss argues for a targeted approach to catch useful issues. The tone remains neutral until davidism expresses disinterest in the changes, leading to a slight escalation of tension as cclauss defends their approach. However, the conversation ends without further conflict.""",0.23
313096908,"""The conversation starts with a request for guidance on an unresolved code issue. facchinm requests ArduinoBot to build the code, and after a successful build, madsdyd notes that the pull request contains code to add a spinner to the Serial Plotter GUI but has some trivial issues that need fixing. chromhelm then mentions that they have made a faulty merge and asks not to pull it yet. The conversation remains neutral until per1234 comments on a related issue, and then CLA assistant checks in, which leads to Wilhelm Wiens being asked to sign the Contributor License Agreement. The tone of the conversation is mostly collaborative and informative, with some minor tension when chromhelm mentions their faulty merge.""",0.07
428860002,"""The conversation starts with ghost asking how to test if an input is analog or digital. rsn8887 responds that the API should provide this information, but ghost is unaware of such a feature. The discussion becomes slightly tense when rsn8887 criticizes ghost's method for testing analog inputs. However, the tone shifts as orbea intervenes, reminding everyone to follow the issue template. The conversation continues with ghost providing more information and rsn8887 explaining how to read analog buttons in the core. Despite some frustration from ghost about not being able to detect a controller's capabilities without pressing every button, the discussion remains relatively civil. The tone becomes more helpful as andres-asm joins in, clarifying that there is no sure way to tell if a controller has analog axis available. The conversation ends with ghost deciding to add controller types and reporting a separate bug for an issue with the deadzone code.""",0.17
529654242,"""Contributors discuss an unresolved build failure issue on AppVeyor. morozov explains the problem and provides a solution, which SenseException acknowledges but questions whether to create a new PR for future PHP 7.4 compatibility. morozov responds neutrally, suggesting to focus on one problem at a time. beberlei joins the conversation, pointing out that the issue also affects another version, escalating the sense of urgency and importance.""",0.12
594259528,"""Contributors discuss an unresolved issue with capturing WebSocket data using mitmproxy and mitmdump. The conversation starts neutrally, with tsujp describing their problem and Kriechi offering suggestions for troubleshooting. However, as the conversation progresses, tsujp becomes increasingly frustrated, expressing impatience and desperation to find a solution. mhils identifies two separate issues in the conversation, one related to certificate verification and another likely due to certificate pinning. The tone of the conversation remains technical and focused on finding a solution, but with an undercurrent of frustration and urgency.""",0.42
1083947035,"""Contributors discuss an updated code change to restore compliance with C++11's Lockable requirement. User1 explains the reasoning behind the update, but User2 questions its tangible benefits and expresses skepticism about the implementation. The conversation becomes slightly tense as User2 criticizes the change, calling it 'clunky' and suggesting it may have unintended consequences. User1 responds calmly, providing additional context and justification for the update.""",0.12
1236349167,"""Contributors discuss renaming Uvicorn loggers. Kludex initiates the conversation with a PR, which is met with mixed reactions from br3ndonland and euri10. Euri10 expresses hesitation about changing the logger name `uvicorn.error` due to its similarity to gunicorn's naming convention, but eventually leaves the decision up to others. The conversation appears to be heading towards keeping the current logger name until doncatnip and alexsantos share their experiences of confusion with the current naming scheme. Kludex has a change of heart and reopens the PR, but later closes it as stale. The conversation ends with zanieb expressing interest in taking over the PR and ltbd78 pushing for the change.""",0.13
1279700430,"""The conversation starts with HighCommander4 reporting a regression issue in vscode 1.67, providing detailed steps to reproduce and analysis of the bug. jrieken responds with a neutral tone, correcting HighCommander4's understanding of the `$0` placeholder and suggesting a workaround. The conversation remains technical and focused on the issue until HighCommander4 expresses mild frustration and disappointment with the behavior change in vscode >= 1.67. kadircet joins the conversation, providing additional context from the LSP spec and supporting HighCommander4's point. The conversation ends with VSCodeTriageBot closing the issue due to lack of recent activity, but HighCommander4 reopens it, requesting further attention to the issue.""",0.23
1292827121,"""Contributors discuss adding a feature to improve usability in CI environments. The conversation starts positively, with User1 expressing enthusiasm and User2 encouraging them to submit a PR. However, the tone shifts when User1 jokingly responds to User2's comment, implying that they are being dismissed. User2 clarifies their intention, but the conversation remains lighthearted. Both users express interest in implementing the feature, but also mention uncertainty about having enough time or whether it will make the cut for a specific release.""",0.15
1344921209,"""Contributors discuss the internal marking of systems and components in Content.*. moonheart08 initiates the conversation by expressing frustration over the unnecessary internal markings, which is echoed by wrexbe. ike709 joins the conversation with a neutral tone, sharing their attempt to address the issue but deciding to hold off due to potential conflicts with another refactor. The conversation takes a slightly assertive turn when wrexbe encourages ike709 to proceed despite the potential conflicts, offering to resolve any merge issues later.""",0.12
501260939,"""The conversation begins with DomAmato introducing a new authentication protocol, Magic, built around the blockchain. arr2036 questions the advantage of using a raw TCP socket over a REST API, leading to a discussion about the module's inefficiencies and lack of technical documentation. DomAmato explains the reasoning behind creating a module instead of using an interpreted language, citing platform limitations. The conversation becomes slightly tense as arr2036 suggests that maintaining a separate fork might be a better option, but DomAmato expresses concerns about added maintenance. alandekok joins in to provide insight on connection pooling, and the discussion shifts to technical details. The tone remains mostly neutral, with some slight frustration from arr2036, until DomAmato concludes by suggesting an internal review of the networking architecture for Magic.""",0.21
1015265872,"""The conversation starts with stevenpitts proposing a new alias for `git pull --rebase origin $(git_main_branch)` and follows the standards checklist. The tone remains neutral until stevenpitts expresses frustration about their PR being ignored, which is met with a dismissive response from SimenB. The conversation then shifts to a discussion between jmeridth and stevenpitts about adding an interactive rebasing feature, maintaining a collaborative tone. However, the tone becomes slightly tense again when carlosala explains that the maintainers are short-handed, causing delays in merging PRs. Overall, the conversation remains mostly civil, with some moments of frustration and disappointment.""",0.42
1065391798,"""The conversation starts with BensaTV requesting a feature to allow plot owners to change ownership without admin permission, which is met with enthusiasm from zOIDAdaJulian. However, NotMyFault opposes the suggested implementation and proposes an alternative `/plot transfer` command that respects economy and grants. The discussion remains civil, with contributors engaging in constructive debate. As the conversation progresses, more users join in, including DevJoey and DueKay, who suggest additional features and considerations. The tone remains collaborative until BensaTV expresses frustration at the lack of progress on the feature request after almost two years, ending the conversation on a slightly tense note.""",0.17
12760224,"""Contributors discuss a code issue related to asset precompilation. nlenepveu proposes a fix, but jimryan requests clarification on the scenario that prompted the change. The conversation remains neutral until jimryan expresses concern about potential issues with rollbacks and asset removal. nlenepveu patiently explains the evaluation process of tasks in Capistrano, and jimryan's tone shifts to one of understanding and appreciation for the explanation. However, jimryan still raises concerns about the fix potentially glossing over a more serious issue, leading to a slightly tense note at the end of the conversation.""",0.22
785540082,"""The conversation begins with MicaelJarniac's PR and a neutral discussion about testing error messages. The tone remains collaborative, with contributors offering suggestions and assistance. However, when jreback closes the issue as stale, the conversation ends on a slightly abrupt note, with no further discussion or resolution.""",0.02
1044081450,"""Several contributors discuss issues with upgrading various packages using WinGet. The conversation starts neutrally but becomes slightly tense when denelon suggests that reporting a single problem at a time would be more effective. MikronT provides detailed logs, and denelon identifies some of the issues as duplicates or related to installer problems. Jedieaston chimes in with potential solutions for Visual Studio Community 2019, which is eventually fixed. The conversation ends on a positive note with the resolution of the Visual Studio issue, but other package-related problems remain open.""",0.23
1071369789,"""The conversation starts with ItzMiracleOwO sharing a link and asking for fixes, followed by sv-22 expressing they are having the same issue. However, Qix-'s response shifts the tone to one of mild frustration and slight condescension as they imply that the others should have read the release notes before encountering the issue.""",0.42
1084099579,"""The conversation begins with vtjnash requesting nanosoldier to run tests and benchmarks for a specific version. Nanosoldier reports errors and failures, which leads to repeated requests from vtjnash to re-run the tasks. The tone remains neutral until KristofferC joins the conversation, asking nanosoldier to run more comprehensive benchmarks. However, nanosoldier's responses become increasingly error-prone, leading to frustration from vtjnash. Despite this, the conversation ends without any personal attacks or escalated tension.""",0.42
1084188772,"""Several contributors discuss a segmentation fault issue with multithreading. User claforte reports the problem and provides reproduction steps, leading to mild frustration. User paulmelis suggests a possible cause, but user claforte is unsure. The conversation escalates as user claforte experiments with different solutions, including a workaround that involves pre-allocating RNGs. Users vchuravy and KristofferC offer suggestions and point out potential issues with the code, leading to a more collaborative tone. However, user claforte's aggressive use of @inline is identified as a contributing factor to the problem. The conversation ends on a note of caution, with user claforte recommending that others be aware of the issue and take steps to prevent similar problems.""",0.12
161100349,"""Contributor torcido reports an issue with namespace handling under JRuby, providing examples of problematic element structures. After some back-and-forth discussion about creating a minimal test case, contributor flavorjones becomes slightly impatient, asking twice for a reproducible test case before ultimately deciding to close the issue due to lack of progress. The conversation ends on a neutral note with torcido's agreement and explanation of their workaround.""",0.15
231424375,"""Contributors discuss clarifying case-insensitive LIKE queries in the documentation. Naatan requests guidance, and coleifer offers a solution using ILIKE, which initially confuses Naatan due to unclear documentation. As the conversation progresses, coleifer's tone becomes slightly defensive, emphasizing that ILIKE is self-explanatory, while Naatan presses for clearer documentation to avoid confusion. The exchange remains polite but tense, with neither party fully resolving the issue.""",0.42
267695504,"""The conversation starts with xremming reporting a slow autocomplete issue with pipenv, which takes around a second to complete. techalchemy and nateprewitt acknowledge the problem and discuss possible solutions. erinxocon tests the issue on their machine and reports similar results. xremming proposes some changes to improve performance, but they are met with skepticism by techalchemy. The conversation continues with other users reporting similar issues and discussing potential solutions. The tone remains collaborative and focused on finding a solution, but there is an undercurrent of frustration and impatience with the slow performance of pipenv.""",0.17
269261234,"""The conversation starts with phallstrom proposing a patch to append formulae descriptions as comments to the generated Brewfile, which passes specs but triggers some Rubocop errors. MikeMcQuaid requests that these errors be fixed, leading to a discussion about the best approach to handle them. The tone remains neutral until MikeMcQuaid suggests making the feature optional, prompting phallstrom to express their opinion on the default behavior. The conversation ends with a stale issue notice from stale[bot], but not before MikeMcQuaid reiterates his preference for not changing the format of everyone's Brewfile.""",0.23
