issue_id,summary,possibility_toxic
245325788,"""The conversation starts with jeffwidman discussing inconsistent naming conventions for the Jinja project, proposing a switch to either 'Jinja' or 'Jinja2' for consistency. davidism suggests dropping the '2' from the name and aligning it with the 3.0 release. The discussion remains neutral until mitsuhiko expresses concerns about backwards incompatibility and potential issues with parallel installations of Python libraries, leading to a more cautious tone. The conversation ends with mitsuhiko retracting their initial support for the rename, citing concerns that outweigh any benefits.""",0.17
421471669,"""Demetrio92 initially reported an issue where adding 1160 minutes to a POSIXct object resulted in NA due to daylight saving time. DavisVaughan explained that this is because lubridate's Period objects work differently than Duration objects, and suggested using Durations instead. Demetrio92 agreed but noted that the difference between Period and Duration can be confusing and proposed deprecating usage of minutes() as it involves autocasting under the hood. Pitakakariki pointed out a scenario where the time-lords decide to do a leap second at the same time as a daylight savings change, which would break the reversibility rule in date-time arithmetic. DavisVaughan explained that the reversibility rule is not the best idea for date-time arithmetic and should not be relied upon.""",0.14
1087972186,"""The conversation starts with tkp206093 reporting a game crash issue and providing system information. doitsujin responds by asking for clarification on an error message, and tkp206093 explains the issue in more detail. The conversation remains neutral until K0bin intervenes, politely asking tkp206093 to refrain from turning the issue into a discussion of an entire NexusMods thread. doitsujin then chimes in, explaining that they need an apitrace to diagnose the issue and mentioning that the game is doing something broken that cannot work properly. The tone remains neutral and technical until Oschowa shares a trace file, after which tkp206093 makes a comment about a possible memory leak with Vulkan on Nvidia cards.""",0.03
1530248637,"""The conversation starts with skull-squadron providing a solution and making a humorous comment about Microsoft Github. However, the tone shifts when hsbt questions the relevance of an issue link, leading to a clarification from skull-squadron. The conversation then becomes more collaborative as deivid-rodriguez acknowledges the fix and thanks skull-squadron for their work, despite some initial uncertainty. Throughout the conversation, skull-squadron's tone remains lighthearted and self-deprecating, while the other participants respond in a neutral or appreciative manner.""",0.05
1291899006,"""RichardNeill initiates a discussion about PHP 8's new warning for undefined array keys, suggesting a configuration option to revert to PHP 7's behavior. Damianwadley responds with a neutral tone, explaining the reasoning behind the change and offering an alternative solution using the `@` operator. RichardNeill expresses frustration and concern about the impact on his codebase, feeling that the change goes against PHP's tradition of backward compatibility. KapitanOczywisty offers a helpful suggestion for filtering the warning, which RichardNeill appreciates and builds upon. The conversation remains civil, with participants engaging in a constructive discussion to find a solution.""",0.03
1465034831,"""JoltSystems reports an issue with game difficulty, describing it as unplayable. Zispah responds neutrally, offering a possible explanation and suggesting that JoltSystems' approach might be flawed. JoltSystems thanks Zispah but expresses continued frustration, indicating that they need to test the issue further to confirm it's not an isolated incident. The conversation remains civil, with no significant tonal shifts or personal attacks.""",0.05
951429255,"""The conversation starts with hmsjy2017 requesting support for ARM architecture on RustDesk, which rustdesk responds to with a joke. The tone shifts as hmsjy2017 provides helpful information and suggestions, but rustdesk becomes defensive when questioned about supporting arm64. Heap-Hop shares their failed attempt to build RustDesk on Raspberry Pi, citing issues with sciter-sdk. The conversation continues with various contributors offering suggestions and assistance, including dimaguy and wwjabc, who successfully compiles RustDesk on armhf and aarch64. However, concerns are raised about the security of using Ubuntu's rootfs and downloading libraries from untrusted sources. Ultimately, rustdesk is persuaded to reconsider their approach, and the conversation ends with a more collaborative tone.""",0.13
914128991,"""The conversation starts with morsyfadl reporting an issue with black bars at the bottom of FMVs in God of War on PCSX2 versions 1.6.0 and 1.7.0. F0bes responds by pointing out that the issue template was not followed, but morsyfadl explains that they tried their best to fill it out correctly. xuru-thor chimes in, sharing a similar experience with the same game on version 1.5.0-dev-2143-g1d983a681. The conversation remains neutral and focused on troubleshooting until refractionpcsx2 suggests checking the Zoom setting, which morsyfadl had already done. The tone shifts slightly when ghost starts complaining about the issue still being present in the dev build of 1.7.0 and refractionpcsx2 responds by explaining that the wiki is user-maintained and not always up-to-date. The conversation ends with a discussion about potential fixes, including adding a GameDB hack or removing the NTSC Saturation modification.""",0.14
436303024,"""The conversation starts with ara4n suggesting a change from 'kick' to a less aggressive term, which is met with resistance from BurnyBoi who argues that 'kick' is not inherently aggressive. jryans supports ara4n's suggestion, but BurnyBoi continues to push back, leading to a slight escalation in tone as he emphasizes the importance of familiarity and efficiency in keeping the '/kick' command. The conversation remains civil but tense, with neither side willing to concede.""",0.42
1252756496,"""Contributor SkybuckFlying initiates a conversation about the SDL project URL, expressing frustration over potential confusion between versions. They share a personal anecdote about wasting 60 minutes due to the issue and makes a general complaint about people's versioning skills. slime73 responds neutrally, explaining the reasoning behind the current URL and pointing out relevant information in the readme. SkybuckFlying persists, emphasizing the importance of clarity in the DLL name, but the conversation remains relatively calm and focused on the technical aspect.""",0.14
549848681,"""Contributor mg979 reports an issue with `:Gwrite` in gVim on Windows, where the command fails to work on files in symlinked directories. tpope requests clarification and details about the setup, which mg979 provides. The conversation becomes slightly tense as tpope points out inconsistencies in mg979's responses and expresses frustration with the lack of clear information. However, the tone remains mostly neutral and focused on troubleshooting the issue. As the discussion progresses, mg979 discovers that the problem may be related to Git for Windows not resolving symlinks automatically, unlike Linux. The conversation ends with tpope suggesting alternative solutions and mg979 deciding to use a workaround by chaining a `Resolve` command with their `Gwrite` mapping.""",0.12
510675125,"""The conversation starts with marekdedic proposing a new feature for Composer, which would allow setting an 'autoloader-root-dir' to enable autoloading from a different directory than the one where composer.json is located. The discussion remains neutral and focused on technical details until alcohol expresses skepticism about the need for this feature, stating that modern web development involves deploying build artifacts, not entire git repositories. Marekdedic clarifies his use case, explaining that he wants to create a 'dist' directory with build artifacts that can be uploaded to a webhosting service. Seldaek suggests alternative solutions, such as configuring the webhosting's webroot or using a different directory structure, but marekdedic explains why these solutions are not suitable for his needs. The conversation ends with RaymondBakker expressing frustration that this feature has not been added yet, advocating for giving people more flexibility.""",0.42
670691047,"""User smallB007 reports an ongoing issue with frustration, prompting jonas-schievink to respond neutrally but firmly, suggesting a more constructive approach. The conversation takes on a slightly tense tone as jonas-schievink cautions against duplicate issues and asks for more information, while also hinting at the emotional toll of negative language on volunteer contributors.""",0.42
907232677,"""A contributor, mbalmer, submits a solution for an issue and is asked by bluca to add a relicense statement. Mbalmers questions the necessity of the statement for a minor code contribution, leading to a mild disagreement. Bluca explains the reasoning behind the request, citing the ease of tracking first-time contributors on GitHub. The conversation remains polite but slightly tense, with mbalmer expressing understanding but also mentioning their limited involvement in the project as a user.""",0.25
1026512862,"""The conversation starts neutrally, with renovate[bot] listing updates and detected dependencies. However, it quickly escalates into a humorous and sarcastic exchange between users, including jokes about marrying the bot, the apocalypse, and the rise of machines. The tone shifts from neutral to playful and mocking, with some users expressing frustration and others making light of the situation. Despite the joking nature of the conversation, there are moments of tension and annoyance, particularly when the bot fails to perform as expected.""",0.42
1102918184,"""Contributor scruel submits a pull request (#1848) to modify utility classes, sparking a brief discussion with snicoll. Initially, scruel's tone is neutral and explanatory, but upon receiving a rejection from snicoll, they express mild frustration and disappointment, questioning the decision. Snicoll responds calmly, justifying their stance, and the conversation ends with a sense of unresolved disagreement.""",0.14
1136028189,"""The conversation starts with Nolij reporting an issue with qBittorrent and OpenVPN, where hostPath mounts are not mounted properly. Ornias1993 responds, stating that multiple users have used this setup without issues and requests more information before reopening the bug report. Nolij provides additional context, and Heavybullets8 verifies the setup, leading to the report being reopened. The conversation continues with other users sharing their experiences, including indivisionjoe, who reports that HostPath works fine for them, and trackready, who confirms the issue persists. Throughout the conversation, Ornias1993 maintains a neutral tone, while Nolij becomes slightly frustrated but remains cooperative. The conversation ends with no resolution to the issue.""",0.08
1181103738,"""The conversation starts with Dremor describing an issue with protonmail-bridge, providing logs and configuration details. MattInternet chimes in, sharing a similar error message. The tone remains neutral and technical until stavros-k responds, welcoming PRs and implying that the issue is still present due to lack of maintenance. sam-kleiner offers a temporary workaround, which Dremor acknowledges but expresses frustration at the lack of a proper fix. xstar97 provides a link to installation notes, but no resolution is reached.""",0.42
1336666723,"""Contributor MaddiFurr reports an issue with audio playback, suggesting that the upstream Lavalink server needs to be updated. Maintainer aikaterna acknowledges the issue and explains that a fix is prepared but other PRs need to be addressed first. The conversation remains neutral until contributor ArchemedIan suggests a quick fix, which is met with criticism from Drapersniper for providing an unsupported solution that could break things for current users. The tone shifts as Drapersniper expresses frustration and concern about the potential consequences of ArchemedIan's suggestion, leading to a slightly tense exchange.""",0.42
315863357,"""The conversation starts with micgro42 raising concerns about DokuWiki's GDPR compliance, sparking a discussion among contributors. The tone remains neutral and informative, with participants sharing their expertise and insights. However, as the conversation progresses, splitbrain becomes slightly defensive and frustrated, expressing annoyance at the number of links being shared and the lack of concrete answers. Despite this, the discussion remains civil, and contributors continue to share their thoughts and suggestions. Traumflug's patches and michitux's usability concerns add a new layer to the conversation, but ultimately, splitbrain decides to close the ticket, acknowledging that definitive answers may not be possible.""",0.42
352750519,"""The conversation starts with dhh suggesting a change in terminology from whitelist/blacklist to allowlist/denylist, citing an example of how it could be implemented. shalvah responds with skepticism, questioning the need for the change and expressing concern that it may come across as patronizing. The tone shifts slightly as ghost enters the conversation, providing some historical context on the origin of the term blacklist. However, dhh remains firm in their suggestion, emphasizing the clarity of the new terms and downplaying the importance of tracing the history of the original words.""",0.43
556620312,"""The conversation starts with SampsonCrowley reporting a bug issue and providing steps to reproduce. The discussion remains neutral until eileencodes points out that test helpers should live in `test/`, not `lib/`. SampsonCrowley expresses frustration, questioning the purpose of the lib folder if files can't be required from it. Eileencodes responds calmly, explaining the mistake and mentioning that they have fixed the documentation. However, eileencodes also notes that SampsonCrowley has multiple issues open on the repo and asks them to refrain from 'yelling' at the volunteers, adding a touch of tension to the conversation.""",0.67
774727384,"""The conversation starts with DaniilAnichin posting a traceback error related to IPython, which sparks a discussion about compatibility issues between IPython and Jedi. Davidhalter provides a temporary fix by downgrading Jedi to version 0.17.2, which is met with gratitude from several users. However, the conversation takes a turn when bl-ue expresses frustration with the lack of a permanent solution and the need for a new release. The discussion becomes more technical, with users discussing dependency resolvers, channel priorities, and the limitations of conda. Amidst the technical discussions, rsokl shares their experience of creating a walkthrough to help students downgrade Jedi, which is met with appreciation from gkuenning. Eventually, h-vetinari announces that anaconda has fixed their repo data, making it work out of the box again. The conversation concludes with Carreau announcing plans to release IPython 7.20 soon, but mostealth expresses disappointment and concern about the long-term implications of not pinning Jedi versions.""",0.23
1047632192,"""The conversation starts with denelon's neutral announcement about reduced activity during the holiday season due to Microsoft employees' paid time off. However, CharlotteEm responds with a sarcastic tone, implying that the employees are being forced to work on holidays to avoid losing their vacation and bonus. Masamune3210 joins in, acknowledging the common practice of companies having use-it-or-lose-it policies for paid time off, but also wishes everyone a relaxing break, which helps to diffuse the tension.""",0.23
1072818585,"""The conversation starts with GeorgeZan describing an issue with SGDClassifier, where the model breaks down when encountering unseen values. ogrisel asks for clarification and requests a minimal reproducible code snippet to test the problem. Nivi09 joins the conversation, rephrasing the issue and seeking confirmation from GeorgeZan. The discussion continues with GeorgeZan providing more details and examples, while ogrisel and glemaitre ask questions and request further clarification. The tone of the conversation remains neutral and technical, with participants seeking to understand and resolve the issue. However, as the conversation progresses, there is a slight increase in frustration and impatience, particularly from GeorgeZan, who feels that his main question is being overlooked. The conversation ends with glemaitre requesting a concrete Python code snippet to discuss the issue further.""",0.17
1665591134,"""PhilETaylor reports a BC break issue with doctrine/orm 2.14.2, expressing frustration that a minor release broke their app despite understanding the deprecated feature. Greg0ire responds neutrally, clarifying the difference between MINOR and PATCH releases and suggesting a solution to downgrade to doctrine/persistence 2. PhilETaylor becomes defensive, sharing that they've already replaced the bundle with an alternative and deployed it to production, but still argues that updating a PATCH version broke their working code. The conversation ends on a slightly tense note.""",0.42
1294541749,"""Contributor Crucibl opens a discussion on an unresolved code issue with the Ghost Gobble Arcade Game exercise. They express frustration and confusion over the use of Boolean expressions, suggesting that the parameters should be evaluated instead. BethanyG responds neutrally, explaining the correct interpretation of the code and offering additional resources for clarification. However, Crucibl continues to express misunderstanding, leading to a slightly tense exchange. BethanyG remains patient and helpful, but also firm in their explanation, ultimately deciding not to change the stub wording due to potential confusion for other students.""",0.22
430055555,"""The conversation starts with Patrickdroid reporting an issue with RetroArch switching the width and height of vertically oriented games. Ghost responds, explaining that some arcades have rotated monitors, but Patrickdroid clarifies that the emulator-provided resolution should not be changed. The discussion becomes slightly tense as ghost suggests that Patrickdroid is misunderstanding the issue, but Patrickdroid insists that altering the internal resolution will result in scaling artifacts. The conversation remains civil, with both parties trying to understand each other's perspectives, but ultimately ends without a clear resolution.""",0.14
952956841,"""barbedknot initiates a discussion on supporting Windows 7 and allowing 'notify when online' notifications without logging in, referencing past versions of Chatterino that had this functionality. Mm2PL responds neutrally, explaining the decision to move to Helix API and its implications, including the deprecation of anonymous title/live checks. However, their tone shifts to become slightly assertive and dismissive when discussing Windows 7 support, stating it's a 12-year-old OS that Microsoft no longer supports. The conversation remains civil but ends with an unresolved issue.""",0.42
1100051808,"""The conversation starts with alexeyzimarev explaining the removal of interfaces from RestSharp and inviting discussion on whether to introduce an interface for `IRestClient`. astrohart argues that having an interface is beneficial for SOLID code and testing, while alexeyzimarev counters that it's not necessary. fjmorel shares their experience with mocking `IRestClient` and how it helps with testing. The conversation becomes more tense when maor-rozenfeld expresses frustration with the removal of interfaces and the pain of upgrading to the latest version of RestSharp. Alexeyzimarev remains open to adding a small interface but is not convinced by the arguments presented.""",0.42
530232265,"""Contributors discuss the deprecation of the `AbstractQuery::useResultCache` method. User moxival initiates the conversation, expressing frustration over the removal and its impact on their code. Users holtkamp and ilianiv share similar concerns and experiences. The discussion becomes slightly tense when user greg0ire suggests a workaround involving a volatile cache, which is met with skepticism by moxival. The tone shifts as greg0ire questions moxival's understanding of the term 'volatile cache', leading to a brief exchange on niceness and clarity. User ilianiv intervenes, suggesting a compromise by adding a proxy method `useResultCache()`, which could satisfy both parties. The conversation ends with user greg0ire considering an alternative solution involving a cache decorator.""",0.22
30381958,"""The conversation starts with a neutral request from ghost to implement xBR shader or xBRZ filter in GSDX plugin, citing its benefits for 2D and sprite-based games. The tone remains informative and technical until Squall-Leonhart's comment, which comes across as slightly dismissive, asking ghost to submit a patch instead of requesting changes. Ghost explains their inability to implement the change due to lack of programming skills, leading to a sympathetic response from DanAE111. However, the conversation takes a turn when LasagnaPie expresses a strong negative opinion about xBR/xBRZ, calling it ugly and preferring Nearest-neighbor interpolation. The tone becomes more heated as ghost defends xBR/xBRZ, citing its use in other emulators and its benefits for certain types of games. Dokman's comment about the performance issues with xBRZ in hardware mode adds a note of frustration to the conversation. The discussion ends with LasagnaPie reiterating their dislike for xBR/xBRZ and ghost emphasizing the importance of having options for different graphics preferences.""",0.67
93644527,"""The conversation starts with TristisOris suggesting a feature to filter out unwanted file extensions from downloads. The discussion remains neutral, with users sharing their support for the idea and potential use cases. However, as the conversation progresses, some users become frustrated with the lack of progress on this feature request since 2015. The tone shifts when FranciascoPombal downplays the importance of the issue, leading to a defensive response from simo1994. The conversation becomes more heated, with users debating the responsibility of qBittorrent in preventing malicious downloads and the need for better security features. Despite some disagreements, the overall sentiment remains in favor of implementing the feature.""",0.42
119143420,"""Several contributors discuss a bug issue with Rails 4.2.5 and Ruby 2.2.3 where the `price?` method returns false for decimal values. User1 (Sega100500) reports the issue, providing examples of the problem. User2 (anujaware) asks for clarification and tries to reproduce the issue but is unable to do so. User3 (sivagollapalli) suggests a possible fix, which User1 confirms as not elegant but potentially correct. The conversation becomes slightly tense when User4 (adityashedge) also fails to reproduce the issue, leading User1 to provide more details about their setup and usage. The tone shifts from collaborative to slightly defensive, with users questioning each other's understanding of the problem.""",0.58
120671163,"""Several contributors discuss an unresolved issue with Doctrine's embeddables. The conversation starts neutrally, but tension arises when a contributor expresses frustration over the lack of support for nullable embeddables. The tone shifts as other contributors join in, sharing their own experiences and workarounds for the issue. Some contributors express disappointment and concern that the issue has not been addressed despite being open for years. The conversation becomes slightly heated, with one contributor stating that they will not invest time in a pull request until lead developers give the green light. However, the tone remains mostly constructive, with contributors offering suggestions and workarounds to help each other. Eventually, the conversation is redirected by a contributor who suggests creating a new issue for further discussion.""",0.42
268049628,"""The conversation starts with mrsarm expressing frustration with pipenv's behavior when installing a new dependency, which updates all outdated dependencies. techalchemy explains that this behavior was intentional and related to OWASP security concerns. The discussion then diverges into a comparison between pipenv and poetry, with some users suggesting that poetry is a more comprehensive solution for dependency management. techalchemy defends pipenv's design philosophy, highlighting the distinction between applications and libraries. The conversation becomes heated, with some users accusing pipenv of being inflexible and others defending its approach. The discussion eventually gets moderated, with techalchemy warning against toxic engagements and encouraging constructive feedback.""",0.67
